VALUE,EVT_NAME,EVT_LF,EVT_PHYS,R,G,B,RED,GREEN,BLUE
7120,Willamette Valley Upland Prairie,Herb,Grassland,203,255,171,0.796078,1,0.670588
7121,Apacherian-Chihuahuan Semi-Desert Shrub-Steppe,Shrub,Shrubland,255,204,51,1,0.8,0.2
7122,Chihuahuan Gypsophilous Grassland and Steppe,Herb,Grassland,255,204,51,1,0.8,0.2
7123,Columbia Plateau Steppe and Grassland,Herb,Grassland,199,176,129,0.780392,0.690196,0.505882
7124,Columbia Plateau Low Sagebrush Steppe,Shrub,Shrubland,135,106,76,0.529412,0.415686,0.298039
7125,Inter-Mountain Basins Big Sagebrush Steppe,Shrub,Shrubland,230,151,41,0.901961,0.592157,0.160784
7126,Inter-Mountain Basins Montane Sagebrush Steppe,Shrub,Shrubland,219,140,37,0.858824,0.54902,0.145098
7127,Inter-Mountain Basins Semi-Desert Shrub-Steppe,Shrub,Shrubland,130,101,72,0.509804,0.396078,0.282353
7128,Northern California Coastal Scrub,Shrub,Shrubland,201,116,30,0.788235,0.454902,0.117647
7129,California Central Valley and Southern Coastal Grassland,Herb,Grassland,255,235,153,1,0.921569,0.6
7130,California Mesic Serpentine Grassland,Herb,Grassland,255,235,153,1,0.921569,0.6
7131,California Northern Coastal Grassland,Herb,Grassland,255,248,148,1,0.972549,0.580392
7132,Central Mixedgrass Prairie Grassland,Herb,Grassland,255,241,140,1,0.945098,0.54902
7133,Chihuahuan Sandy Plains Semi-Desert Grassland,Herb,Grassland,255,233,135,1,0.913725,0.529412
7134,Columbia Basin Foothill and Canyon Dry Grassland,Herb,Grassland,255,226,130,1,0.886275,0.509804
7135,Inter-Mountain Basins Semi-Desert Grassland,Herb,Grassland,255,200,125,1,0.784314,0.490196
7136,Mediterranean California Alpine Dry Tundra,Herb,Grassland,255,211,119,1,0.827451,0.466667
7137,Mediterranean California Subalpine Meadow,Herb,Grassland,255,205,112,1,0.803922,0.439216
7138,North Pacific Montane Grassland,Herb,Grassland,255,198,107,1,0.776471,0.419608
7139,Northern Rocky Mountain Lower Montane-Foothill-Valley Grassland,Herb,Grassland,255,191,102,1,0.74902,0.4
7140,Northern Rocky Mountain Subalpine-Upper Montane Grassland,Herb,Grassland,255,184,97,1,0.721569,0.380392
7141,Northwestern Great Plains Mixedgrass Prairie,Herb,Grassland,255,176,92,1,0.690196,0.360784
7142,Columbia Basin Palouse Prairie,Herb,Grassland,255,198,107,1,0.776471,0.419608
7143,Rocky Mountain Alpine Fell-Field,Herb,Grassland,171,145,106,0.670588,0.568627,0.415686
7144,Rocky Mountain Alpine Turf,Herb,Grassland,171,145,106,0.670588,0.568627,0.415686
7145,Rocky Mountain Subalpine-Montane Mesic Meadow,Herb,Grassland,255,163,82,1,0.639216,0.321569
7146,Southern Rocky Mountain Montane-Subalpine Grassland,Herb,Grassland,171,145,106,0.670588,0.568627,0.415686
7147,Western Great Plains Foothill and Piedmont Grassland,Herb,Grassland,255,157,77,1,0.615686,0.301961
7148,Western Great Plains Sand Prairie,Herb,Grassland,255,148,71,1,0.580392,0.278431
7149,Western Great Plains Shortgrass Prairie,Herb,Grassland,255,142,66,1,0.556863,0.258824
7150,Western Great Plains Tallgrass Prairie,Herb,Grassland,255,137,64,1,0.537255,0.25098
7151,California Central Valley Riparian Woodland,Tree,Riparian,81,180,141,0.317647,0.705882,0.552941
7152,California Central Valley Riparian Shrubland,Shrub,Riparian,81,180,141,0.317647,0.705882,0.552941
7153,Inter-Mountain Basins Greasewood Flat,Shrub,Shrubland,194,170,126,0.760784,0.666667,0.494118
7156,North Pacific Lowland Riparian Forest,Tree,Riparian,67,162,181,0.262745,0.635294,0.709804
7157,North Pacific Lowland Riparian Shrubland,Shrub,Riparian,67,162,181,0.262745,0.635294,0.709804
7158,North Pacific Montane Riparian Woodland,Tree,Riparian,67,162,181,0.262745,0.635294,0.709804
7159,North Pacific Montane Riparian Shrubland,Shrub,Riparian,67,162,181,0.262745,0.635294,0.709804
7161,Northern Rocky Mountain Conifer Swamp,Tree,Riparian,4,45,117,0.015686,0.176471,0.458824
7165,Northern Rocky Mountain Foothill Conifer Wooded Steppe,Tree,Conifer,55,146,173,0.215686,0.572549,0.678431
7166,Middle Rocky Mountain Montane Douglas-fir Forest and Woodland,Tree,Conifer,0,51,0,0,0.2,0
7167,Rocky Mountain Poor-Site Lodgepole Pine Forest,Tree,Conifer,163,240,219,0.639216,0.941176,0.858824
7168,Northern Rocky Mountain Avalanche Chute Shrubland,Shrub,Shrubland,128,97,69,0.501961,0.380392,0.270588
7169,Northern Rocky Mountain Subalpine Deciduous Shrubland,Shrub,Shrubland,128,97,69,0.501961,0.380392,0.270588
7170,Klamath-Siskiyou Xeromorphic Serpentine Savanna,Tree,Conifer,224,252,192,0.878431,0.988235,0.752941
7171,North Pacific Alpine and Subalpine Dry Grassland,Herb,Grassland,255,114,48,1,0.447059,0.188235
7172,Sierran-Intermontane Desert Western White Pine-White Fir Woodland,Tree,Conifer,0,204,0,0,0.8,0
7173,North Pacific Wooded Volcanic Flowage,Tree,Conifer,163,240,219,0.639216,0.941176,0.858824
7174,North Pacific Dry-Mesic Silver Fir-Western Hemlock-Douglas-fir Forest,Tree,Conifer,0,71,0,0,0.278431,0
7177,California Coastal Closed-Cone Conifer Forest and Woodland,Tree,Conifer,224,252,192,0.878431,0.988235,0.752941
7178,North Pacific Hypermaritime Western Red-cedar-Western Hemlock Forest,Tree,Conifer,4,45,117,0.015686,0.176471,0.458824
7179,Northwestern Great Plains-Black Hills Ponderosa Pine Woodland and Savanna,Tree,Conifer,214,255,181,0.839216,1,0.709804
7191,Recently Logged-Herb and Grass Cover,Herb,Grassland,255,68,25,1,0.266667,0.098039
7192,Recently Logged-Shrub Cover,Shrub,Shrubland,255,68,25,1,0.266667,0.098039
7193,Recently Logged-Tree Cover,Tree,Conifer,255,68,25,1,0.266667,0.098039
7195,Recently Burned-Herb and Grass Cover,Herb,Grassland,255,59,20,1,0.231373,0.078431
7196,Recently Burned-Shrub Cover,Shrub,Shrubland,255,59,20,1,0.231373,0.078431
7197,Recently Burned-Tree Cover,Tree,Conifer,255,59,20,1,0.231373,0.078431
7198,Recently Disturbed Other-Herb and Grass Cover,Herb,Grassland,255,68,25,1,0.266667,0.098039
7199,Recently Disturbed Other-Shrub Cover,Shrub,Shrubland,255,68,25,1,0.266667,0.098039
7200,Recently Disturbed Other-Tree Cover,Tree,Conifer,255,68,25,1,0.266667,0.098039
7207,Central Mixedgrass Prairie Shrubland,Shrub,Shrubland,255,241,140,1,0.945098,0.54902
7234,Mediterranean California Mesic Serpentine Chaparral,Shrub,Shrubland,224,252,192,0.878431,0.988235,0.752941
7238,Laurentian-Acadian Northern Oak Forest,Tree,Hardwood,174,245,224,0.682353,0.960784,0.878431
7239,Laurentian-Acadian Northern Pine-(Oak) Forest,Tree,Conifer-Hardwood,174,245,224,0.682353,0.960784,0.878431
7240,Laurentian-Acadian Hardwood Forest,Tree,Hardwood,0,92,0,0,0.360784,0
7241,Laurentian-Acadian Pine-Hemlock-Hardwood Forest,Tree,Conifer-Hardwood,0,92,0,0,0.360784,0
7242,Laurentian Oak Barrens,Tree,Hardwood,174,245,224,0.682353,0.960784,0.878431
7243,Laurentian Pine-Oak Barrens,Tree,Conifer-Hardwood,174,245,224,0.682353,0.960784,0.878431
7247,Southern Appalachian Grass Bald,Herb,Grassland,82,52,34,0.321569,0.203922,0.133333
7248,Northern Atlantic Coastal Plain Dune and Swale Grassland,Herb,Grassland,255,98,41,1,0.384314,0.160784
7249,Atlantic Coastal Plain Peatland Pocosin and Canebrake Shrubland,Shrub,Riparian,91,195,199,0.356863,0.764706,0.780392
7250,Inter-Mountain Basins Curl-leaf Mountain Mahogany Shrubland,Shrub,Shrubland,155,235,216,0.607843,0.921569,0.847059
7256,Apacherian-Chihuahuan Semi-Desert Grassland,Herb,Grassland,255,204,51,1,0.8,0.2
7260,Mediterranean California Lower Montane Black Oak Forest and Woodland,Tree,Hardwood,0,189,0,0,0.741176,0
7261,Mediterranean California Lower Montane Black Oak-Conifer Forest and Woodland,Tree,Conifer-Hardwood,0,189,0,0,0.741176,0
7262,East Cascades Oak Forest and Woodland,Tree,Hardwood,214,255,181,0.839216,1,0.709804
7263,East Cascades Oak-Ponderosa Pine Forest and Woodland,Tree,Conifer-Hardwood,214,255,181,0.839216,1,0.709804
7264,California Lower Montane Blue Oak Woodland and Savanna,Tree,Hardwood,121,217,207,0.47451,0.85098,0.811765
7265,California Lower Montane Blue Oak-Foothill Pine Woodland and Savanna,Tree,Conifer-Hardwood,121,217,207,0.47451,0.85098,0.811765
7268,Eastern Great Plains Tallgrass Aspen Shrubland,Shrub,Shrubland,192,255,138,0.752941,1,0.541176
7270,Klamath-Siskiyou Xeromorphic Serpentine Chaparral,Shrub,Shrubland,224,252,192,0.878431,0.988235,0.752941
7272,Eastern Boreal Floodplain Shrubland,Shrub,Riparian,50,137,168,0.196078,0.537255,0.658824
7286,Paleozoic Plateau Bluff and Talus Herbaceous,Herb,Grassland,85,187,194,0.333333,0.733333,0.760784
7288,Acadian-Appalachian Alpine Tundra Meadow,Herb,Grassland,82,52,34,0.321569,0.203922,0.133333
7289,Acadian-Appalachian Subalpine Heath-Krummholz,Shrub,Shrubland,82,52,34,0.321569,0.203922,0.133333
7290,North-Central Oak Barrens Herbaceous,Herb,Grassland,44,127,163,0.172549,0.498039,0.639216
7291,Central Interior Highlands Calcareous Glade and Barrens Herbaceous,Herb,Grassland,255,153,0,1,0.6,0
7292,Open Water,Water,Open Water,0,0,255,0,0,1
7295,Quarries-Strip Mines-Gravel Pits-Well and Wind Pads,Barren,Quarries-Strip Mines-Gravel Pits-Well and Wind Pads,230,232,250,0.901961,0.909804,0.980392
7296,Developed-Low Intensity,Developed,Developed-Low Intensity,255,122,143,1,0.478431,0.560784
7297,Developed-Medium Intensity,Developed,Developed-Medium Intensity,253,44,79,0.992157,0.172549,0.309804
7298,Developed-High Intensity,Developed,Developed-High Intensity,173,0,28,0.678431,0,0.109804
7299,Developed-Roads,Developed,Developed-Roads,1,1,1,0.003922,0.003922,0.003922
7300,Developed-Open Space,Developed,Developed-Open Space,52,52,52,0.203922,0.203922,0.203922
7301,Laurentian-Acadian Sub-boreal Aspen-Birch Forest,Tree,Hardwood,192,255,138,0.752941,1,0.541176
7302,Laurentian-Acadian Northern Hardwoods Forest,Tree,Hardwood,171,255,138,0.670588,1,0.541176
7303,Northeastern Interior Dry-Mesic Oak Forest,Tree,Hardwood,85,187,194,0.333333,0.733333,0.760784
7304,Ozark-Ouachita Dry-Mesic Oak Forest,Tree,Hardwood,85,187,194,0.333333,0.733333,0.760784
7305,Southern Interior Low Plateau Dry-Mesic Oak Forest,Tree,Hardwood,13,69,133,0.05098,0.270588,0.521569
7306,East Gulf Coastal Plain Northern Loess Plain Oak-Hickory Upland,Tree,Hardwood,85,187,194,0.333333,0.733333,0.760784
7307,East Gulf Coastal Plain Northern Dry Upland Hardwood Forest,Tree,Hardwood,85,187,194,0.333333,0.733333,0.760784
7308,Crosstimbers Oak Forest and Woodland,Tree,Hardwood,85,187,194,0.333333,0.733333,0.760784
7309,Southern Appalachian Northern Hardwood Forest,Tree,Hardwood,216,216,191,0.847059,0.847059,0.74902
7310,North-Central Interior Dry-Mesic Oak Forest and Woodland,Tree,Hardwood,85,187,194,0.333333,0.733333,0.760784
7311,North-Central Interior Dry Oak Forest and Woodland,Tree,Hardwood,85,187,194,0.333333,0.733333,0.760784
7312,Ouachita Montane Oak Forest,Tree,Hardwood,85,187,194,0.333333,0.733333,0.760784
7313,North-Central Interior Beech-Maple Forest,Tree,Hardwood,0,92,0,0,0.360784,0
7314,North-Central Interior Maple-Basswood Forest,Tree,Hardwood,171,255,138,0.670588,1,0.541176
7315,Southern Appalachian Oak Forest,Tree,Hardwood,13,69,133,0.05098,0.270588,0.521569
7316,Southern Piedmont Mesic Forest,Tree,Hardwood,85,187,194,0.333333,0.733333,0.760784
7317,Allegheny-Cumberland Dry Oak Forest and Woodland,Tree,Hardwood,13,69,133,0.05098,0.270588,0.521569
7318,Southern and Central Appalachian Cove Forest,Tree,Hardwood,18,76,135,0.070588,0.298039,0.529412
7320,Central and Southern Appalachian Montane Oak Forest,Tree,Hardwood,85,187,194,0.333333,0.733333,0.760784
7321,South-Central Interior Mesophytic Forest,Tree,Hardwood,0,38,115,0,0.14902,0.45098
7322,Crowley's Ridge Mesic Loess Slope Forest,Tree,Hardwood,85,187,194,0.333333,0.733333,0.760784
7323,West Gulf Coastal Plain Mesic Hardwood Forest,Tree,Hardwood,145,255,115,0.568627,1,0.45098
7324,Northern Atlantic Coastal Plain Hardwood Forest,Tree,Hardwood,85,187,194,0.333333,0.733333,0.760784
7325,East Gulf Coastal Plain Northern Mesic Hardwood Slope Forest,Tree,Hardwood,159,255,128,0.623529,1,0.501961
7326,South-Central Interior / Upper Coastal Plain Flatwoods,Tree,Hardwood,85,187,194,0.333333,0.733333,0.760784
7327,East Gulf Coastal Plain Northern Loess Bluff Forest,Tree,Hardwood,85,187,194,0.333333,0.733333,0.760784
7328,Southern Coastal Plain Limestone Forest,Tree,Hardwood,100,204,206,0.392157,0.8,0.807843
7329,East Gulf Coastal Plain Southern Loess Bluff Forest,Tree,Hardwood,100,204,206,0.392157,0.8,0.807843
7330,Southern Coastal Plain Dry Upland Hardwood Forest,Tree,Hardwood,145,255,115,0.568627,1,0.45098
7331,Eastern Great Plains Tallgrass Aspen Forest and Woodland,Tree,Hardwood,192,255,138,0.752941,1,0.541176
7333,South Florida Hardwood Hammock,Tree,Hardwood,60,113,126,0.235294,0.443137,0.494118
7334,Ozark-Ouachita Mesic Hardwood Forest,Tree,Hardwood,85,187,194,0.333333,0.733333,0.760784
7335,Southern Atlantic Coastal Plain Dry and Dry-Mesic Oak Forest,Tree,Hardwood,145,255,115,0.568627,1,0.45098
7336,Southwest Florida Maritime Hammock,Tree,Hardwood,60,113,126,0.235294,0.443137,0.494118
7337,Southeast Florida Maritime Hammock,Tree,Hardwood,60,113,126,0.235294,0.443137,0.494118
7338,Central and South Texas Coastal Fringe Forest and Woodland,Tree,Hardwood,145,255,115,0.568627,1,0.45098
7339,West Gulf Coastal Plain Chenier and Upper Texas Coastal Fringe Forest and Woodland,Tree,Hardwood,145,255,115,0.568627,1,0.45098
7340,Appalachian Shale Barrens,Tree,Conifer-Hardwood,82,52,34,0.321569,0.203922,0.133333
7342,Piedmont Hardpan Woodland and Forest,Tree,Hardwood,85,187,194,0.333333,0.733333,0.760784
7343,Southern Atlantic Coastal Plain Mesic Hardwood Forest,Tree,Hardwood,145,255,115,0.568627,1,0.45098
7346,Atlantic Coastal Plain Fall-line Sandhills Longleaf Pine Woodland,Tree,Conifer,116,214,204,0.454902,0.839216,0.8
7347,Atlantic Coastal Plain Upland Longleaf Pine Woodland,Tree,Conifer,116,214,204,0.454902,0.839216,0.8
7348,West Gulf Coastal Plain Upland Longleaf Pine Forest and Woodland,Tree,Conifer,116,214,204,0.454902,0.839216,0.8
7349,East Gulf Coastal Plain Interior Upland Longleaf Pine Woodland,Tree,Conifer,116,214,204,0.454902,0.839216,0.8
7350,Central and Southern Appalachian Spruce-Fir Forest,Tree,Conifer,159,255,128,0.623529,1,0.501961
7351,Southeastern Interior Longleaf Pine Woodland,Tree,Conifer,116,214,204,0.454902,0.839216,0.8
7352,Southern Appalachian Montane Pine Forest and Woodland,Tree,Conifer,13,69,133,0.05098,0.270588,0.521569
7353,Southern Appalachian Low-Elevation Pine Forest,Tree,Conifer,10,61,128,0.039216,0.239216,0.501961
7354,Northeastern Interior Pine Barrens,Tree,Conifer,116,214,204,0.454902,0.839216,0.8
7355,Northern Atlantic Coastal Plain Pitch Pine Barrens,Tree,Conifer,116,214,204,0.454902,0.839216,0.8
7356,Florida Longleaf Pine Sandhill,Tree,Conifer,116,214,204,0.454902,0.839216,0.8
7357,Southern Coastal Plain Mesic Slope Forest,Tree,Hardwood,145,255,115,0.568627,1,0.45098
7358,Bastrop Lost Pines Forest and Woodland,Tree,Conifer,85,187,194,0.333333,0.733333,0.760784
7360,South Florida Pine Rockland,Tree,Conifer,13,69,133,0.05098,0.270588,0.521569
7361,Central Atlantic Coastal Plain Maritime Forest,Tree,Hardwood,107,209,206,0.419608,0.819608,0.807843
7362,Laurentian-Acadian Northern Pine Forest,Tree,Conifer,174,245,224,0.682353,0.960784,0.878431
7363,Central Interior Highlands Dry Acidic Glade and Barrens,Tree,Conifer-Hardwood,255,153,0,1,0.6,0
7364,Ozark-Ouachita Dry Oak Woodland,Tree,Hardwood,85,187,194,0.333333,0.733333,0.760784
7366,Laurentian-Acadian Pine-Hemlock Forest,Tree,Conifer,0,92,0,0,0.360784,0
7367,Ozark-Ouachita Shortleaf Pine Forest and Woodland,Tree,Conifer,116,214,190,0.454902,0.839216,0.745098
7368,Southern Piedmont Dry Pine Forest,Tree,Conifer,159,255,128,0.623529,1,0.501961
7369,Central Appalachian Dry Pine Forest,Tree,Conifer,13,69,133,0.05098,0.270588,0.521569
7370,Appalachian Hemlock Forest,Tree,Conifer,0,38,115,0,0.14902,0.45098
7371,West Gulf Coastal Plain Pine Forest,Tree,Conifer,145,255,115,0.568627,1,0.45098
7372,East Gulf Coastal Plain Interior Shortleaf Pine Forest,Tree,Conifer,116,214,190,0.454902,0.839216,0.745098
7373,Acadian Low-Elevation Spruce-Fir Forest,Tree,Conifer,186,54,14,0.729412,0.211765,0.054902
7374,Acadian-Appalachian Montane Spruce-Fir Forest,Tree,Conifer-Hardwood,186,54,14,0.729412,0.211765,0.054902
7375,Eastern Serpentine Woodland,Tree,Conifer-Hardwood,0,38,115,0,0.14902,0.45098
7376,Southern Ridge and Valley / Cumberland Dry Calcareous Forest,Tree,Hardwood,85,187,194,0.333333,0.733333,0.760784
7377,Central Appalachian Pine Rocky Woodland,Tree,Conifer,13,69,133,0.05098,0.270588,0.521569
7378,West Gulf Coastal Plain Sandhill Shortleaf Pine Forest and Woodland,Tree,Conifer,116,214,190,0.454902,0.839216,0.745098
7379,Northern Atlantic Coastal Plain Maritime Forest,Tree,Hardwood,145,255,115,0.568627,1,0.45098
7380,East Gulf Coastal Plain Maritime Forest,Tree,Hardwood,107,209,206,0.419608,0.819608,0.807843
7381,Lower Mississippi River Dune Woodland and Forest,Tree,Hardwood,85,187,194,0.333333,0.733333,0.760784
7382,Southern Atlantic Coastal Plain Maritime Forest,Tree,Hardwood,107,209,206,0.419608,0.819608,0.807843
7383,Edwards Plateau Limestone Savanna and Woodland,Tree,Hardwood,34,109,153,0.133333,0.427451,0.6
7384,Mississippi Delta Maritime Forest,Tree,Hardwood,145,255,115,0.568627,1,0.45098
7385,Great Plains Wooded Draw and Ravine Woodland,Tree,Riparian,128,97,69,0.501961,0.380392,0.270588
7386,Acadian-Appalachian Alpine Tundra Shrubland,Shrub,Shrubland,82,52,34,0.321569,0.203922,0.133333
7387,Florida Peninsula Inland Scrub Shrubland,Shrub,Shrubland,145,255,115,0.568627,1,0.45098
7389,Acadian-Appalachian Subalpine Woodland,Tree,Conifer,82,52,34,0.321569,0.203922,0.133333
7390,Tamaulipan Mixed Deciduous Thornscrub,Shrub,Shrubland,82,52,34,0.321569,0.203922,0.133333
7391,Tamaulipan Mesquite Upland Woodland,Tree,Hardwood,82,52,34,0.321569,0.203922,0.133333
7392,Tamaulipan Calcareous Thornscrub,Shrub,Shrubland,82,52,34,0.321569,0.203922,0.133333
7393,Edwards Plateau Limestone Shrubland,Shrub,Shrubland,34,109,153,0.133333,0.427451,0.6
7394,North-Central Interior Oak Savanna,Tree,Hardwood,6,53,122,0.023529,0.207843,0.478431
7395,North-Central Oak Barrens Woodland,Tree,Hardwood,44,127,163,0.172549,0.498039,0.639216
7396,Great Plains Wooded Draw and Ravine Shrubland,Shrub,Riparian,128,97,69,0.501961,0.380392,0.270588
7397,Nashville Basin Limestone Glade and Woodland,Tree,Conifer-Hardwood,82,52,34,0.321569,0.203922,0.133333
7398,Cumberland Sandstone Glade and Barrens,Tree,Conifer-Hardwood,82,52,34,0.321569,0.203922,0.133333
7399,Northern Atlantic Coastal Plain Grassland,Herb,Grassland,240,165,46,0.941176,0.647059,0.180392
7400,Central Appalachian Alkaline Glade and Woodland,Tree,Conifer-Hardwood,82,52,34,0.321569,0.203922,0.133333
7401,Central Interior Highlands Calcareous Glade and Barrens Woodland,Tree,Conifer-Hardwood,255,153,0,1,0.6,0
7403,West Gulf Coastal Plain Catahoula Barrens,Tree,Conifer-Hardwood,116,214,204,0.454902,0.839216,0.8
7405,West Gulf Coastal Plain Nepheline Syenite Glade,Tree,Conifer-Hardwood,255,153,0,1,0.6,0
7406,Southern Piedmont Dry Oak Forest,Tree,Hardwood,159,255,128,0.623529,1,0.501961
7407,Laurentian Pine Barrens,Tree,Conifer,174,245,224,0.682353,0.960784,0.878431
7408,Alabama Ketona Glade and Woodland,Tree,Conifer-Hardwood,82,52,34,0.321569,0.203922,0.133333
7409,Great Lakes Alvar,Herb,Grassland,216,216,191,0.847059,0.847059,0.74902
7410,Llano Uplift Acidic Forest and Woodland,Tree,Conifer-Hardwood,34,109,153,0.133333,0.427451,0.6
7411,Great Lakes Wet-Mesic Lakeplain Prairie,Herb,Riparian,255,92,38,1,0.360784,0.14902
7412,North-Central Interior Sand and Gravel Tallgrass Prairie,Herb,Grassland,255,137,64,1,0.537255,0.25098
7413,Bluegrass Savanna and Woodland Prairie,Herb,Grassland,82,52,34,0.321569,0.203922,0.133333
7414,Southern Appalachian Shrub Bald,Shrub,Shrubland,82,52,34,0.321569,0.203922,0.133333
7415,Arkansas Valley Prairie,Herb,Grassland,255,153,0,1,0.6,0
7416,Western Highland Rim Prairie and Barrens,Herb,Grassland,82,52,34,0.321569,0.203922,0.133333
7417,Eastern Highland Rim Prairie and Barrens,Herb,Grassland,82,52,34,0.321569,0.203922,0.133333
7418,Pennyroyal Karst Plain Prairie and Barrens,Herb,Grassland,82,52,34,0.321569,0.203922,0.133333
7419,Southern Ridge and Valley Patch Prairie,Herb,Grassland,82,52,34,0.321569,0.203922,0.133333
7420,Northern Tallgrass Prairie,Herb,Grassland,255,137,64,1,0.537255,0.25098
7421,Central Tallgrass Prairie,Herb,Grassland,255,137,64,1,0.537255,0.25098
7422,Texas Blackland Tallgrass Prairie,Herb,Grassland,255,148,71,1,0.580392,0.278431
7423,Southeastern Great Plains Tallgrass Prairie,Herb,Grassland,255,137,64,1,0.537255,0.25098
7424,East-Central Texas Plains Xeric Sandyland,Herb,Grassland,255,153,0,1,0.6,0
7425,Florida Dry Prairie Grassland,Herb,Grassland,116,214,204,0.454902,0.839216,0.8
7426,Southern Atlantic Coastal Plain Dune and Maritime Grassland,Herb,Grassland,255,153,0,1,0.6,0
7428,West Gulf Coastal Plain Northern Calcareous Prairie,Herb,Grassland,255,148,71,1,0.580392,0.278431
7429,West Gulf Coastal Plain Southern Calcareous Prairie,Herb,Grassland,255,148,71,1,0.580392,0.278431
7430,Southern Coastal Plain Blackland Prairie,Herb,Grassland,0,38,115,0,0.14902,0.45098
7431,Southwest Florida Dune and Coastal Grassland,Herb,Grassland,255,153,0,1,0.6,0
7434,Texas-Louisiana Coastal Prairie,Herb,Riparian,255,137,64,1,0.537255,0.25098
7435,East Gulf Coastal Plain Dune and Coastal Grassland,Herb,Grassland,255,153,0,1,0.6,0
7436,Northern Atlantic Coastal Plain Dune and Swale Shrubland,Shrub,Shrubland,255,98,41,1,0.384314,0.160784
7437,Texas Coast Dune and Coastal Grassland,Herb,Grassland,255,153,0,1,0.6,0
7438,Tamaulipan Savanna Grassland,Herb,Grassland,82,52,34,0.321569,0.203922,0.133333
7439,Tamaulipan Lomas,Shrub,Shrubland,255,171,87,1,0.670588,0.341176
7441,Bluegrass Savanna and Woodland,Tree,Hardwood,82,52,34,0.321569,0.203922,0.133333
7442,Arkansas Valley Prairie and Woodland,Tree,Hardwood,255,153,0,1,0.6,0
7444,Eastern Boreal Floodplain Woodland,Tree,Riparian,50,137,168,0.196078,0.537255,0.658824
7445,South Florida Dwarf Cypress Savanna,Tree,Riparian,91,195,199,0.356863,0.764706,0.780392
7446,South Florida Pine Flatwoods,Tree,Conifer,116,214,204,0.454902,0.839216,0.8
7447,South Florida Cypress Dome,Tree,Riparian,91,195,199,0.356863,0.764706,0.780392
7448,Southern Piedmont Dry Oak-(Pine) Forest,Tree,Conifer-Hardwood,159,255,128,0.623529,1,0.501961
7449,Central Atlantic Coastal Plain Wet Longleaf Pine Savanna and Flatwoods,Tree,Riparian,116,214,204,0.454902,0.839216,0.8
7450,Southern Atlantic Coastal Plain Wet Pine Savanna and Flatwoods,Tree,Riparian,116,214,204,0.454902,0.839216,0.8
7451,West Gulf Coastal Plain Wet Longleaf Pine Savanna and Flatwoods,Tree,Riparian,116,214,204,0.454902,0.839216,0.8
7452,Atlantic Coastal Plain Peatland Pocosin and Canebrake Woodland,Tree,Riparian,91,195,199,0.356863,0.764706,0.780392
7453,Central Florida Pine Flatwoods,Tree,Conifer,116,214,204,0.454902,0.839216,0.8
7454,East Gulf Coastal Plain Near-Coast Pine Flatwoods,Tree,Conifer,116,214,204,0.454902,0.839216,0.8
7455,East Gulf Coastal Plain Southern Loblolly Flatwoods,Tree,Conifer,100,204,206,0.392157,0.8,0.807843
7456,Northern Atlantic Coastal Plain Pitch Pine Lowland,Tree,Riparian,116,214,204,0.454902,0.839216,0.8
7457,South-Central Interior / Upper Coastal Plain Wet Flatwoods,Tree,Riparian,145,255,115,0.568627,1,0.45098
7458,West Gulf Coastal Plain Pine Flatwoods,Tree,Conifer,145,255,115,0.568627,1,0.45098
7459,Atlantic Coastal Plain Clay-Based Carolina Bay Wetland,Tree,Riparian,91,195,199,0.356863,0.764706,0.780392
7460,Southern Coastal Plain Nonriverine Cypress Dome,Tree,Riparian,91,195,199,0.356863,0.764706,0.780392
7461,Southern Coastal Plain Seepage Swamp and Baygall Woodland,Tree,Riparian,216,216,191,0.847059,0.847059,0.74902
7462,West Gulf Coastal Plain Seepage Swamp and Baygall,Tree,Riparian,216,216,191,0.847059,0.847059,0.74902
7463,Central Appalachian Dry Oak Forest,Tree,Hardwood,13,69,133,0.05098,0.270588,0.521569
7464,Acadian Sub-Boreal Spruce Barrens,Tree,Conifer,186,163,119,0.729412,0.639216,0.466667
7465,Acadian Sub-Boreal Spruce Flat,Tree,Conifer,186,54,14,0.729412,0.211765,0.054902
7466,Great Lakes Wooded Dune and Swale,Tree,Riparian,174,245,224,0.682353,0.960784,0.878431
7467,Tamaulipan Floodplain Woodland,Tree,Riparian,6,53,122,0.023529,0.207843,0.478431
7468,Atlantic Coastal Plain Streamhead Seepage Swamp-Pocosin-Baygall Woodland,Tree,Riparian,216,216,191,0.847059,0.847059,0.74902
7469,Atlantic Coastal Plain Streamhead Seepage Swamp-Pocosin-Baygall Shrubland,Shrub,Riparian,216,216,191,0.847059,0.847059,0.74902
7471,Southwest Florida Coastal Strand Shrubland,Shrub,Shrubland,60,113,126,0.235294,0.443137,0.494118
7472,Southeast Florida Coastal Strand Shrubland,Shrub,Shrubland,60,113,126,0.235294,0.443137,0.494118
7474,Tamaulipan Floodplain Shrubland,Shrub,Riparian,6,53,122,0.023529,0.207843,0.478431
7475,Tamaulipan Floodplain Herbaceous ,Herb,Riparian,6,53,122,0.023529,0.207843,0.478431
7476,Tamaulipan Riparian Woodland,Tree,Riparian,6,53,122,0.023529,0.207843,0.478431
7481,Laurentian-Acadian Alkaline Conifer-Hardwood Swamp,Tree,Riparian,50,137,168,0.196078,0.537255,0.658824
7482,Great Plains Prairie Pothole,Herb,Riparian,91,195,199,0.356863,0.764706,0.780392
7483,South Florida Everglades Sawgrass Marsh,Herb,Riparian,255,153,0,1,0.6,0
7484,South Florida Wet Marl Prairie,Herb,Riparian,255,153,0,1,0.6,0
7485,East Gulf Coastal Plain Wet Prairie,Herb,Riparian,255,153,0,1,0.6,0
7486,Texas Saline Coastal Prairie,Herb,Riparian,255,153,0,1,0.6,0
7487,Texas-Louisiana Coastal Prairie Pondshore,Herb,Riparian,255,137,64,1,0.537255,0.25098
7488,Eastern Great Plains Wet Meadow-Prairie-Marsh,Herb,Riparian,91,195,199,0.356863,0.764706,0.780392
7489,Floridian Highlands Freshwater Marsh,Herb,Riparian,255,153,0,1,0.6,0
7500,South Texas Salt and Brackish Tidal Flat,Sparse,Sparsely Vegetated,100,100,100,0.392157,0.392157,0.392157
7501,Southern Atlantic Coastal Plain Nonriverine Swamp and Wet Hardwood Forest,Tree,Riparian,216,216,191,0.847059,0.847059,0.74902
7502,Central Appalachian Dry Oak-Pine Forest,Tree,Conifer-Hardwood,13,69,133,0.05098,0.270588,0.521569
