VALUE,EVT_NAME,EVT_LF,EVT_PHYS,R,G,B,RED,GREEN,BLUE
-9999,Fill-NoData,NA,NA,255,255,255,1,1,1
4401,Alaska Arctic Coastal Sedge-Dwarf-Shrubland,Shrub,Shrubland,255,205,112,1,0.803922,0.439216
4402,Alaska Arctic Floodplain Forest,Tree,Riparian,18,76,135,0.070588,0.298039,0.529412
4403,Alaska Arctic Large River Floodplain Forest,Tree,Riparian,18,76,135,0.070588,0.298039,0.529412
4404,Alaska Arctic Mesic Alder Shrubland,Shrub,Shrubland,146,237,224,0.572549,0.929412,0.878431
4405,Alaska Arctic Permafrost Plateau Dwarf-Shrub Lichen Tundra,Shrub,Shrubland,255,37,13,1,0.145098,0.05098
4406,Alaska Arctic Tidal Flat,Sparse,Sparsely Vegetated,255,153,10,1,0.6,0.039216
4407,Alaska Sub-boreal and Maritime Alpine Mesic Herbaceous Meadow,Herb,Grassland,255,211,119,1,0.827451,0.466667
4408,Alaska Sub-boreal Mesic Subalpine Alder Shrubland,Shrub,Shrubland,146,237,224,0.572549,0.929412,0.878431
4409,Alaska Sub-boreal Mountain Hemlock-White Spruce Forest,Tree,Conifer,182,250,227,0.713725,0.980392,0.890196
4410,Alaska Sub-boreal White-Lutz Spruce Forest and Woodland,Tree,Conifer,182,250,227,0.713725,0.980392,0.890196
4411,Alaskan Pacific Acidic Shrub Peatland,Shrub,Riparian,133,39,8,0.521569,0.152941,0.031373
4412,Alaskan Pacific Alpine-Subalpine Dwarf-shrubland & Heath,Shrub,Shrubland,212,129,34,0.831373,0.505882,0.133333
4413,Alaskan Pacific Floodplain Conifer Forest,Tree,Riparian,18,76,135,0.070588,0.298039,0.529412
4414,Alaskan Pacific Maritime Alpine Floodplain Shrubland,Shrub,Riparian,18,76,135,0.070588,0.298039,0.529412
4415,Alaskan Pacific Maritime Avalanche Slope Shrubland,Shrub,Shrubland,146,237,224,0.572549,0.929412,0.878431
4416,Alaskan Pacific Maritime Coastal Meadow and Slough-Levee,Herb,Grassland,255,0,0,1,0,0
4417,Alaskan Pacific Maritime Mesic Herbaceous Meadow,Herb,Grassland,255,85,33,1,0.333333,0.129412
4418,Alaskan Pacific Maritime Mountain Hemlock-Shore Pine Peatland,Tree,Conifer,133,39,8,0.521569,0.152941,0.031373
4419,Alaskan Pacific Maritime Western Hemlock Forest,Tree,Conifer,4,45,117,0.015686,0.176471,0.458824
4420,Alaskan Pacific Mesic Western Hemlock-Yellow-cedar Forest,Tree,Conifer,0,82,0,0,0.321569,0
4421,Alaskan Pacific Mountain Hemlock Forest and Subalpine Woodland ,Tree,Conifer,0,92,0,0,0.360784,0
4422,Alaskan Pacific Poorly Drained Conifer Woodland,Tree,Conifer,79,36,26,0.309804,0.141176,0.101961
4423,Alaskan Pacific Sitka Spruce Forest and Beach Ridge,Tree,Conifer,0,117,0,0,0.458824,0
4424,Alaskan Pacific Wet Low Shrubland & Floodplain Wetland,Shrub,Riparian,255,153,0,1,0.6,0
4425,Alaskan Pacific-Aleutian Alder-Salmonberry-Copperbush Shrubland,Shrub,Shrubland,146,237,224,0.572549,0.929412,0.878431
4426,Alaskan Pacific-Aleutian Coastal Dune Beach and Beach Meadow,Herb,Grassland,255,0,0,1,0,0
4427,Alaskan Pacific-Aleutian Fen and Wet Meadow,Herb,Riparian,255,205,112,1,0.803922,0.439216
4428,Alaskan Pacific-Aleutian Rocky Coastline and Sea Cliff,Sparse,Sparsely Vegetated,100,100,100,0.392157,0.392157,0.392157
4429,Aleutian Ericaceous Dwarf-shrubland Heath and Fell-field,Shrub,Shrubland,79,36,26,0.309804,0.141176,0.101961
4430,Aleutian Mesic Herbaceous Meadow,Herb,Grassland,255,85,33,1,0.333333,0.129412
4431,Aleutian Mesic-Wet Willow Shrubland,Shrub,Shrubland,73,175,188,0.286275,0.686275,0.737255
4432,Aleutian Volcanic Rock and Talus,Sparse,Sparsely Vegetated,100,100,100,0.392157,0.392157,0.392157
4434,North American Arctic Bedrock and Talus,Sparse,Sparsely Vegetated,100,100,100,0.392157,0.392157,0.392157
4435,North American Arctic Dryas Tundra,Shrub,Shrubland,194,68,21,0.760784,0.266667,0.082353
4436,North American Arctic Dwarf-Shrub Lichen Tundra,Shrub,Shrubland,255,102,0,1,0.4,0
4437,North American Arctic Dwarf-shrub-Sphagnum Peatland,Shrub,Riparian,133,39,8,0.521569,0.152941,0.031373
4438,North American Arctic Freshwater Marsh,Herb,Riparian,255,153,0,1,0.6,0
4439,North American Arctic Lichen Tundra,Herb,Grassland,255,37,13,1,0.145098,0.05098
4440,North American Arctic Mesic Herbaceous Meadow,Herb,Grassland,255,85,33,1,0.333333,0.129412
4441,North American Arctic Mesic Sedge-Willow Tundra,Shrub,Shrubland,194,68,21,0.760784,0.266667,0.082353
4442,North American Arctic Mesic-Wet Low Willow Shrubland,Shrub,Shrubland,73,175,188,0.286275,0.686275,0.737255
4443,North American Arctic Polygonal Ground Shrub-Tussock Tundra,Shrub,Shrubland,194,68,21,0.760784,0.266667,0.082353
4444,North American Arctic Scrub Birch-Ericaceous Shrubland,Shrub,Shrubland,212,129,34,0.831373,0.505882,0.133333
4445,North American Arctic Sparse Tundra,Shrub,Shrubland,255,102,0,1,0.4,0
4446,North American Arctic Wet Sedge Tundra and Polygonal Ground ,Herb,Riparian,255,205,112,1,0.803922,0.439216
4447,North American Arctic-Subarctic Coastal Dune & Beach Meadow,Herb,Grassland,255,0,0,1,0,0
4448,North American Arctic-Subarctic Shrub-Tussock Tundra,Shrub,Shrubland,255,73,28,1,0.286275,0.109804
4449,North American Arctic-Subarctic Tidal Salt and Brackish Marsh,Herb,Riparian,255,153,10,1,0.6,0.039216
4450,North American Arctic-Subarctic Tussock Tundra,Herb,Grassland,255,73,28,1,0.286275,0.109804
4453,Western North American Boreal Alpine Dwarf-shrubland,Shrub,Shrubland,212,129,34,0.831373,0.505882,0.133333
4454,Western North American Boreal Alpine Mesic Herbaceous Meadow,Herb,Grassland,255,211,119,1,0.827451,0.466667
4455,Western North American Boreal Montane-Alpine Talus and Bedrock,Sparse,Sparsely Vegetated,100,100,100,0.392157,0.392157,0.392157
4456,Western North American Boreal Black Spruce Bog and Dwarf-Tree Peatland,Tree,Conifer,79,36,26,0.309804,0.141176,0.101961
4457,Western North American Boreal Black Spruce-Tamarack Fen,Tree,Conifer,182,250,255,0.713725,0.980392,1
4458,Western North American Boreal Cliff Scree and Rock,Sparse,Sparsely Vegetated,100,100,100,0.392157,0.392157,0.392157
4459,Western North American Boreal Dry Aspen-Steppe Bluff,Shrub,Shrubland,192,255,138,0.752941,1,0.541176
4460,Western North American Boreal Dry Grassland,Herb,Grassland,255,114,48,1,0.447059,0.188235
4461,Western North American Boreal Freshwater Emergent Marsh,Herb,Riparian,255,153,0,1,0.6,0
4462,Western North American Boreal Lowland Large River Floodplain Conifer Forest,Tree,Riparian,18,76,135,0.070588,0.298039,0.529412
4463,Western North American Boreal Mesic Birch-Aspen Forest,Tree,Hardwood,0,92,0,0,0.360784,0
4464,Western North American Boreal Mesic Bluejoint-Forb Meadow,Herb,Riparian,255,25,8,1,0.098039,0.031373
4465,Western North American Boreal Mesic Scrub Birch-Willow Shrubland,Shrub,Shrubland,73,175,188,0.286275,0.686275,0.737255
4466,Western North American Boreal Mesic White Spruce Forest,Tree,Conifer,182,250,227,0.713725,0.980392,0.890196
4467,Western North American Boreal Mesic-Wet Black Spruce Forest and Woodland,Tree,Conifer,182,250,227,0.713725,0.980392,0.890196
4468,Western North American Boreal Montane Floodplain Conifer Forest,Tree,Riparian,18,76,135,0.070588,0.298039,0.529412
4469,Western North American Boreal Riparian Stringer Conifer Forest,Tree,Riparian,18,76,135,0.070588,0.298039,0.529412
4470,Western North American Boreal Shrub Floodplain,Shrub,Riparian,255,153,0,1,0.6,0
4471,Western North American Boreal Shrub Swamp,Shrub,Shrubland,166,76,17,0.65098,0.298039,0.066666
4472,Western North American Boreal Shrub-Sedge Bog & Acidic Fen,Shrub,Shrubland,150,58,12,0.588235,0.227451,0.047059
4473,Western North American Boreal Shrub-Sedge Rich and Alkaline Fen,Shrub,Riparian,255,205,112,1,0.803922,0.439216
4474,Western North American Boreal Spruce-Lichen Woodland,Tree,Conifer,182,250,227,0.713725,0.980392,0.890196
4475,Western North American Boreal Treeline White Spruce Woodland,Tree,Conifer,182,250,227,0.713725,0.980392,0.890196
4476,Western North American Boreal Wet Black Spruce-Tussock Woodland,Tree,Conifer,182,250,255,0.713725,0.980392,1
4477,Western North American Boreal Wet Meadow,Herb,Riparian,255,205,112,1,0.803922,0.439215
4478,Western North American Boreal Treeline Hardwood-White Spruce Woodland,Tree,Hardwood,18,76,135,0.070588,0.298039,0.529412
4479,Western North American Boreal Treeline White Spruce-Hardwood Woodland,Tree,Conifer-Hardwood,159,255,128,0.623529,1,0.501961
4480,Western North American Boreal Mesic Hardwood-White Spruce Forest,Tree,Conifer-Hardwood,159,255,128,0.623529,1,0.501961
4481,Western North American Boreal Mesic White Spruce-Hardwood Forest,Tree,Conifer-Hardwood,159,255,128,0.623529,1,0.501961
4482,Alaska Sub-boreal Hardwood-White-Lutz Spruce Forest and Woodland,Tree,Conifer-Hardwood,159,255,128,0.623529,1,0.501961
4483,Alaska Sub-boreal White-Lutz Spruce-Hardwood Forest and Woodland,Tree,Conifer-Hardwood,159,255,128,0.623529,1,0.501961
4484,Western North American Boreal Mesic-Wet Black Spruce-Hardwood Forest and Woodland,Tree,Conifer-Hardwood,182,250,227,0.713725,0.980392,0.890196
4485,Alaskan Pacific Floodplain Deciduous Forest,Tree,Riparian,18,76,135,0.070588,0.298039,0.529412
4486,Alaskan Pacific Floodplain Mixed Forest,Tree,Riparian,18,76,135,0.070588,0.298039,0.529412
4487,Western North American Boreal Lowland Large River Floodplain Deciduous Forest,Tree,Riparian,18,76,135,0.070588,0.298039,0.529412
4488,Western North American Boreal Lowland Large River Floodplain Mixed Forest,Tree,Riparian,18,76,135,0.070588,0.298039,0.529412
4489,Western North American Boreal Montane Floodplain Deciduous Forest,Tree,Riparian,18,76,135,0.070588,0.298039,0.529412
4490,Western North American Boreal Montane Floodplain Mixed Forest,Tree,Riparian,18,76,135,0.070588,0.298039,0.529412
4491,Western North American Boreal Riparian Stringer Deciduous Forest,Tree,Riparian,18,76,135,0.070588,0.298039,0.529412
4492,Western North American Boreal Riparian Stringer Mixed Forest,Tree,Riparian,18,76,135,0.070588,0.298039,0.529412
4601,Micronesian Dry Cliff,Sparse,Sparsely Vegetated,100,100,100,0.392157,0.392157,0.392157
4602,Micronesian Dry-Site Lava Flow,Sparse,Sparsely Vegetated,100,100,100,0.392157,0.392157,0.392157
4603,Micronesian Dry Coastal Strand,Sparse,Sparsely Vegetated,100,100,100,0.392157,0.392157,0.392157
4604,Micronesian Lowland Rain Forest,Tree,Hardwood,0,189,0,0,0.741176,0
4605,Micronesian Lowland Limestone Forest,Tree,Hardwood,63,255,46,0.247059,1,0.180392
4606,Central and Southern Polynesian Montane Rainforest,Tree,Hardwood,0,189,0,0,0.741176,0
4609,Micronesian Ravine and Riparian Forest,Tree,Hardwood,0,237,0,0,0.929412,0
4610,Polynesian Freshwater Marsh,Herb,Riparian,255,153,0,1,0.6,0
4611,Micronesian Swamp Forest,Tree,Riparian,67,162,181,0.262745,0.635294,0.709804
4612,Western Pacific Mangrove,Tree,Hardwood,0,237,0,0,0.929412,0
4614,Central and Southern Polynesian Coastal Wooded Strand,Tree,Hardwood,0,189,0,0,0.741176,0
4615,Central and Southern Polynesian Cliff,Sparse,Sparsely Vegetated,100,100,100,0.392157,0.392157,0.392157
4616,Central and Southern Polynesian Lava Flow,Sparse,Sparsely Vegetated,100,100,100,0.392157,0.392157,0.392157
4617,Central and Southern Polynesian Dry Coastal Strand,Sparse,Sparsely Vegetated,100,100,100,0.392157,0.392157,0.392157
4618,Central and Southern Polynesian Lowland Rain Forest,Tree,Hardwood,224,252,192,0.878431,0.988235,0.752941
4620,Central and Southern Polynesian Cloud Forest,Tree,Hardwood,0,204,0,0,0.8,0
4621,Central and Southern Polynesian Littoral Forest,Tree,Hardwood,42,255,31,0.164706,1,0.121569
4622,Central and Southern Polynesian Ravine and Riparian Forest,Tree,Hardwood,0,237,0,0,0.929412,0
4623,Central and Southern Polynesian Swamp Forest,Tree,Riparian,67,162,181,0.262745,0.635294,0.709804
4624,Micronesian Ravine and Riparian Shrubland,Shrub,Riparian,0,237,0,0,0.929412,0
4627,Central and Southern Polynesian Dry Coastal Strand Shrubland,Shrub,Shrubland,42,255,31,0.164706,1,0.121569
4628,Central and Southern Polynesian Dry Coastal Strand Herbaceous,Herb,Grassland,42,255,31,0.164706,1,0.121569
4629,Micronesian Dry Coastal Strand Shrubland,Shrub,Shrubland,42,255,31,0.164706,1,0.121569
4630,Micronesian Dry Coastal Strand Herbaceous,Herb,Grassland,42,255,31,0.164706,1,0.121569
4902,Alaska Arctic Floodplain Shrubland,Shrub,Riparian,18,76,135,0.070588,0.298039,0.529412
4903,Alaska Arctic Large River Floodplain Shrubland,Shrub,Riparian,18,76,135,0.070588,0.298039,0.529412
4904,Alaska Arctic Floodplain Herbaceous,Herb,Riparian,18,76,135,0.070588,0.298039,0.529412
4905,Alaska Arctic Large River Floodplain Herbaceous,Herb,Riparian,18,76,135,0.070588,0.298039,0.529412
4911,Alaskan Pacific Acidic Sedge Peatland,Herb,Riparian,133,39,8,0.521569,0.152941,0.031373
4913,Alaskan Pacific Floodplain Shrubland (Conifer Forest),Shrub,Riparian,18,76,135,0.070588,0.298039,0.529412
4914,Alaskan Pacific Maritime Alpine Floodplain Herbaceous,Herb,Riparian,255,153,0,1,0.6,0
4937,North American Arctic Wet Sedge-Sphagnum Peatland,Herb,Riparian,133,39,8,0.521569,0.152941,0.031373
4943,North American Arctic Polygonal Ground Tussock Tundra,Herb,Grassland,255,73,28,1,0.286275,0.109804
4947,North American Arctic-Subarctic Coastal Dune & Beach,Sparse,Sparsely Vegetated,100,100,100,0.392157,0.392157,0.392157
4962,Western North American Boreal Lowland Large River Floodplain Shrubland (Conifer Forest),Shrub,Riparian,18,76,135,0.070588,0.298039,0.529412
4963,Western North American Boreal Lowland Large River Floodplain Sparse Vegetation,Sparse,Sparsely Vegetated,100,100,100,0.392157,0.392157,0.392157
4964,Western North American Boreal Montane Floodplain Sparse Vegetation,Sparse,Sparsely Vegetated,100,100,100,0.392157,0.392157,0.392157
4965,Alaskan Pacific Floodplain Sparse Vegetation,Sparse,Sparsely Vegetated,100,100,100,0.392157,0.392157,0.392157
4966,Alaska Arctic Large River Floodplain Sparse Vegetation ,Sparse,Sparsely Vegetated,100,100,100,0.392157,0.392157,0.392157
4968,Western North American Boreal Montane Floodplain Shrubland (Conifer Forest),Shrub,Riparian,18,76,135,0.070588,0.298039,0.529412
4969,Western North American Boreal Riparian Stringer Shrubland (Conifer Forest),Shrub,Riparian,18,76,135,0.070588,0.298039,0.529412
4970,Western North American Boreal Herbaceous Floodplain,Herb,Riparian,255,153,0,1,0.6,0
4973,Western North American Boreal Herbaceous Rich and Alkaline Fen,Herb,Riparian,255,205,112,1,0.803922,0.439216
4985,Alaskan Pacific Floodplain Shrubland (Deciduous Forest),Shrub,Riparian,18,76,135,0.070588,0.298039,0.529412
4986,Alaskan Pacific Floodplain Shrubland (Mixed Forest),Shrub,Riparian,18,76,135,0.070588,0.298039,0.529412
4987,Western North American Boreal Lowland Large River Floodplain Shrubland (Deciduous Forest),Shrub,Riparian,18,76,135,0.070588,0.298039,0.529412
4988,Western North American Boreal Lowland Large River Floodplain Shrubland (Mixed Forest),Shrub,Riparian,18,76,135,0.070588,0.298039,0.529412
4989,Western North American Boreal Montane Floodplain Shrubland (Deciduous Forest),Shrub,Riparian,18,76,135,0.070588,0.298039,0.529412
4990,Western North American Boreal Montane Floodplain Shrubland (Mixed Forest),Shrub,Riparian,18,76,135,0.070588,0.298039,0.529412
4991,Western North American Boreal Riparian Stringer Shrubland (Deciduous Forest),Shrub,Riparian,18,76,135,0.070588,0.298039,0.529412
4992,Western North American Boreal Riparian Stringer Shrubland (Mixed Forest),Shrub,Riparian,18,76,135,0.070588,0.298039,0.529412
7008,North Pacific Oak Woodland,Tree,Hardwood,203,255,171,0.796078,1,0.670588
7009,Northwestern Great Plains Aspen Forest and Parkland,Tree,Hardwood,192,255,138,0.752941,1,0.541176
7010,Northern Rocky Mountain Western Larch Savanna,Tree,Conifer,180,255,148,0.705882,1,0.580392
7011,Rocky Mountain Aspen Forest and Woodland,Tree,Hardwood,192,255,138,0.752941,1,0.541176
7012,Rocky Mountain Bigtooth Maple Ravine Woodland,Tree,Hardwood,171,255,138,0.670588,1,0.541176
7013,Western Great Plains Dry Bur Oak Forest and Woodland,Tree,Hardwood,6,53,122,0.023529,0.207843,0.478431
7014,Central and Southern California Mixed Evergreen Woodland,Tree,Conifer,145,255,115,0.568627,1,0.45098
7015,California Coastal Redwood Forest,Tree,Conifer,135,255,105,0.529412,1,0.411765
7016,Colorado Plateau Pinyon-Juniper Woodland,Tree,Conifer,121,255,94,0.47451,1,0.368627
7017,Columbia Plateau Western Juniper Woodland and Savanna,Tree,Conifer,108,255,82,0.423529,1,0.321569
7018,East Cascades Mesic Montane Mixed-Conifer Forest and Woodland,Tree,Conifer,96,255,71,0.376471,1,0.278431
7019,Great Basin Pinyon-Juniper Woodland,Tree,Conifer,78,255,59,0.305882,1,0.231373
7020,Inter-Mountain Basins Subalpine Limber-Bristlecone Pine Woodland,Tree,Conifer,63,255,46,0.247059,1,0.180392
7021,Klamath-Siskiyou Lower Montane Serpentine Mixed Conifer Woodland,Tree,Conifer,42,255,31,0.164706,1,0.121569
7022,Klamath-Siskiyou Upper Montane Serpentine Mixed Conifer Woodland,Tree,Conifer,224,252,192,0.878431,0.988235,0.752941
7023,Madrean Encinal,Tree,Conifer-Hardwood,0,237,0,0,0.929412,0
7024,Madrean Lower Montane Pine-Oak Forest and Woodland,Tree,Conifer-Hardwood,0,237,0,0,0.929412,0
7025,Madrean Pinyon-Juniper Woodland,Tree,Conifer,121,255,94,0.47451,1,0.368627
7026,Madrean Upper Montane Conifer-Oak Forest and Woodland,Tree,Conifer-Hardwood,0,237,0,0,0.929412,0
7027,Mediterranean California Dry-Mesic Mixed Conifer Forest and Woodland,Tree,Conifer,0,222,0,0,0.870588,0
7028,Mediterranean California Mesic Mixed Conifer Forest and Woodland,Tree,Conifer,0,204,0,0,0.8,0
7029,Mediterranean California Mixed Oak Woodland,Tree,Hardwood,0,189,0,0,0.741176,0
7030,Mediterranean California Lower Montane Conifer Forest and Woodland,Tree,Conifer,0,189,0,0,0.741176,0
7031,California Montane Jeffrey Pine-(Ponderosa Pine) Woodland,Tree,Conifer,0,173,0,0,0.678431,0
7032,Mediterranean California Red Fir Forest,Tree,Conifer,0,158,0,0,0.619608,0
7033,Mediterranean California Subalpine Woodland,Tree,Conifer,0,145,0,0,0.568627,0
7034,Mediterranean California Mesic Serpentine Woodland,Tree,Conifer,224,252,192,0.878431,0.988235,0.752941
7035,North Pacific Dry Douglas-fir-(Madrone) Forest and Woodland,Tree,Conifer,0,130,0,0,0.509804,0
7036,North Pacific Seasonal Sitka Spruce Forest,Tree,Conifer,0,117,0,0,0.458824,0
7037,North Pacific Maritime Dry-Mesic Douglas-fir-Western Hemlock Forest,Tree,Conifer,0,105,0,0,0.411765,0
7038,North Pacific Maritime Mesic Subalpine Parkland,Tree,Conifer,0,92,0,0,0.360784,0
7039,North Pacific Maritime Mesic-Wet Douglas-fir-Western Hemlock Forest,Tree,Conifer,0,105,0,0,0.411765,0
7041,North Pacific Mountain Hemlock Forest,Tree,Conifer,0,92,0,0,0.360784,0
7042,North Pacific Mesic Western Hemlock-Silver Fir Forest,Tree,Conifer,0,71,0,0,0.278431,0
7043,Mediterranean California Mixed Evergreen Forest,Tree,Conifer,0,61,0,0,0.239216,0
7044,Northern California Mesic Subalpine Woodland,Tree,Conifer,0,92,0,0,0.360784,0
7045,Northern Rocky Mountain Dry-Mesic Montane Mixed Conifer Forest,Tree,Conifer,0,51,0,0,0.2,0
7046,Northern Rocky Mountain Subalpine Woodland and Parkland,Tree,Conifer,191,255,233,0.74902,1,0.913725
7047,Northern Rocky Mountain Mesic Montane Mixed Conifer Forest,Tree,Conifer,96,255,71,0.376471,1,0.278431
7048,Northwestern Great Plains Highland White Spruce Woodland,Tree,Conifer,182,250,227,0.713725,0.980392,0.890196
7049,Rocky Mountain Foothill Limber Pine-Juniper Woodland,Tree,Conifer,174,245,224,0.682353,0.960784,0.878431
7050,Rocky Mountain Lodgepole Pine Forest,Tree,Conifer,163,240,219,0.639216,0.941176,0.858824
7051,Southern Rocky Mountain Dry-Mesic Montane Mixed Conifer Forest and Woodland,Tree,Conifer,0,51,0,0,0.2,0
7052,Southern Rocky Mountain Mesic Montane Mixed Conifer Forest and Woodland,Tree,Conifer,0,204,0,0,0.8,0
7053,Northern Rocky Mountain Ponderosa Pine Woodland and Savanna,Tree,Conifer,214,255,181,0.839216,1,0.709804
7054,Southern Rocky Mountain Ponderosa Pine Woodland,Tree,Conifer,214,255,181,0.839216,1,0.709804
7055,Rocky Mountain Subalpine Dry-Mesic Spruce-Fir Forest and Woodland,Tree,Conifer,236,252,204,0.92549,0.988235,0.8
7056,Rocky Mountain Subalpine Mesic-Wet Spruce-Fir Forest and Woodland,Tree,Conifer,236,252,204,0.92549,0.988235,0.8
7057,Rocky Mountain Subalpine-Montane Limber-Bristlecone Pine Woodland,Tree,Conifer,63,255,46,0.247059,1,0.180392
7058,Sierra Nevada Subalpine Lodgepole Pine Forest and Woodland,Tree,Conifer,163,240,219,0.639216,0.941176,0.858824
7059,Southern Rocky Mountain Pinyon-Juniper Woodland,Tree,Conifer,121,255,94,0.47451,1,0.368627
7060,East Cascades Ponderosa Pine Forest and Woodland,Tree,Conifer,214,255,181,0.839216,1,0.709804
7061,Inter-Mountain Basins Aspen-Mixed Conifer Forest and Woodland,Tree,Conifer-Hardwood,192,255,138,0.752941,1,0.541176
7062,Inter-Mountain Basins Curl-leaf Mountain Mahogany Woodland,Tree,Conifer,155,235,216,0.607843,0.921569,0.847059
7063,North Pacific Broadleaf Landslide Forest,Tree,Hardwood,146,232,215,0.572549,0.909804,0.843137
7064,Colorado Plateau Mixed Low Sagebrush Shrubland,Shrub,Shrubland,204,182,135,0.8,0.713725,0.529412
7065,Columbia Plateau Scabland Shrubland,Shrub,Shrubland,199,176,129,0.780392,0.690196,0.505882
7066,Inter-Mountain Basins Mat Saltbush Shrubland,Shrub,Shrubland,194,170,126,0.760784,0.666667,0.494118
7067,Mediterranean California Alpine Fell-Field,Shrub,Shrubland,255,211,119,1,0.827451,0.466667
7068,North Pacific Dry and Mesic Alpine Dwarf-Shrubland,Shrub,Shrubland,181,156,114,0.709804,0.611765,0.447059
7069,North Pacific Dry and Mesic Alpine Fell-field or Meadow,Herb,Grassland,181,156,114,0.709804,0.611765,0.447059
7070,Rocky Mountain Alpine Dwarf-Shrubland,Shrub,Shrubland,171,145,106,0.670588,0.568627,0.415686
7071,Sierra Nevada Alpine Dwarf-Shrubland,Shrub,Shrubland,255,211,119,1,0.827451,0.466667
7072,Wyoming Basins Dwarf Sagebrush Shrubland and Steppe,Shrub,Shrubland,204,182,135,0.8,0.713725,0.529412
7073,Baja Semi-Desert Coastal Succulent Scrub,Shrub,Shrubland,166,139,107,0.65098,0.545098,0.419608
7074,Chihuahuan Creosotebush Desert Scrub,Shrub,Shrubland,161,134,96,0.631373,0.52549,0.376471
7075,Chihuahuan Mixed Salt Desert Scrub,Shrub,Shrubland,156,128,92,0.611765,0.501961,0.360784
7076,Chihuahuan Stabilized Coppice Dune and Sand Flat Scrub,Shrub,Shrubland,150,123,89,0.588235,0.482353,0.34902
7077,Chihuahuan Succulent Desert Scrub,Shrub,Shrubland,145,117,84,0.568627,0.458824,0.329412
7078,Colorado Plateau Blackbrush-Mormon-tea Shrubland,Shrub,Shrubland,140,112,80,0.54902,0.439216,0.313725
7079,Great Basin Xeric Mixed Sagebrush Shrubland,Shrub,Shrubland,135,106,76,0.529412,0.415686,0.298039
7080,Inter-Mountain Basins Big Sagebrush Shrubland,Shrub,Shrubland,130,101,72,0.509804,0.396078,0.282353
7081,Inter-Mountain Basins Mixed Salt Desert Scrub,Shrub,Shrubland,156,128,92,0.611765,0.501961,0.360784
7082,Mojave Mid-Elevation Mixed Desert Scrub,Shrub,Shrubland,140,112,80,0.54902,0.439216,0.313725
7083,North Pacific Avalanche Chute Shrubland,Shrub,Shrubland,128,97,69,0.501961,0.380392,0.270588
7084,North Pacific Montane Shrubland,Shrub,Shrubland,128,97,69,0.501961,0.380392,0.270588
7085,Northwestern Great Plains Shrubland,Shrub,Shrubland,122,93,65,0.478431,0.364706,0.254902
7086,Rocky Mountain Lower Montane-Foothill Shrubland,Shrub,Shrubland,117,87,61,0.458824,0.341176,0.239216
7087,Sonora-Mojave Creosotebush-White Bursage Desert Scrub,Shrub,Shrubland,161,134,96,0.631373,0.52549,0.376471
7088,Sonora-Mojave Mixed Salt Desert Scrub,Shrub,Shrubland,156,128,92,0.611765,0.501961,0.360784
7090,Sonoran Granite Outcrop Desert Scrub,Shrub,Shrubland,161,134,96,0.631373,0.52549,0.376471
7091,Sonoran Mid-Elevation Desert Scrub,Shrub,Shrubland,161,134,96,0.631373,0.52549,0.376471
7092,Southern California Coastal Scrub,Shrub,Shrubland,166,139,107,0.65098,0.545098,0.419608
7093,Southern Colorado Plateau Sand Shrubland,Shrub,Shrubland,112,82,57,0.439216,0.321569,0.223529
7094,Western Great Plains Sandhill Steppe,Shrub,Shrubland,112,82,57,0.439216,0.321569,0.223529
7096,California Maritime Chaparral,Shrub,Shrubland,107,77,54,0.419608,0.301961,0.211765
7097,California Mesic Chaparral,Shrub,Shrubland,59,30,19,0.231373,0.117647,0.07451
7098,California Montane Woodland and Chaparral,Shrub,Shrubland,66,37,24,0.258824,0.145098,0.094118
7099,California Xeric Serpentine Chaparral,Shrub,Shrubland,66,37,24,0.258824,0.145098,0.094118
7100,Chihuahuan Mixed Desert and Thornscrub,Shrub,Shrubland,74,44,29,0.290196,0.172549,0.113725
7101,Madrean Oriental Chaparral,Shrub,Shrubland,145,117,84,0.568627,0.458824,0.329412
7102,Colorado Plateau Pinyon-Juniper Shrubland,Shrub,Shrubland,121,255,94,0.47451,1,0.368627
7103,Great Basin Semi-Desert Chaparral,Shrub,Shrubland,89,59,40,0.34902,0.231373,0.156863
7104,Mogollon Chaparral,Shrub,Shrubland,89,59,40,0.34902,0.231373,0.156863
7105,Northern and Central California Dry-Mesic Chaparral,Shrub,Shrubland,99,69,47,0.388235,0.270588,0.184314
7106,Northern Rocky Mountain Montane-Foothill Deciduous Shrubland,Shrub,Shrubland,117,87,61,0.458824,0.341176,0.239216
7107,Rocky Mountain Gambel Oak-Mixed Montane Shrubland,Shrub,Shrubland,245,175,54,0.960784,0.686275,0.211765
7108,Sonora-Mojave Semi-Desert Chaparral,Shrub,Shrubland,89,59,40,0.34902,0.231373,0.156863
7109,Sonoran Paloverde-Mixed Cacti Desert Scrub,Shrub,Shrubland,242,168,48,0.94902,0.658824,0.188235
7110,Southern California Dry-Mesic Chaparral,Shrub,Shrubland,99,69,47,0.388235,0.270588,0.184314
7111,Western Great Plains Mesquite Shrubland,Shrub,Shrubland,150,123,89,0.588235,0.482353,0.34902
7112,California Central Valley Mixed Oak Savanna,Tree,Hardwood,138,227,212,0.541176,0.890196,0.831373
7113,California Coastal Live Oak Woodland and Savanna,Tree,Hardwood,131,222,110,0.513725,0.870588,0.431373
7114,California Lower Montane Foothill Pine Woodland and Savanna,Tree,Conifer,121,217,207,0.47451,0.85098,0.811765
7115,Inter-Mountain Basins Juniper Savanna,Tree,Conifer,78,255,59,0.305882,1,0.231373
7116,Madrean Juniper Savanna,Tree,Conifer,145,117,84,0.568627,0.458824,0.329412
7117,Southern Rocky Mountain Ponderosa Pine Savanna,Tree,Conifer,214,255,181,0.839216,1,0.709804
7118,Southern California Oak Woodland and Savanna,Tree,Hardwood,131,222,110,0.513725,0.870588,0.431373
7119,Southern Rocky Mountain Juniper Woodland and Savanna,Tree,Conifer,121,255,94,0.47451,1,0.368627
