VALUE,EVT_NAME,EVT_LF,EVT_PHYS,R,G,B,RED,GREEN,BLUE
7503,Chihuahuan Loamy Plains Desert Grassland,Herb,Grassland,255,204,51,1,0.8,0.2
7504,Chihuahuan-Sonoran Desert Bottomland and Swale Grassland,Herb,Riparian,255,204,51,1,0.8,0.2
7505,Ouachita Novaculite Glade and Woodland,Tree,Hardwood,85,187,194,0.333333,0.733333,0.760784
7506,West Gulf Coastal Plain Nonriverine Wet Hardwood Flatwoods,Tree,Riparian,145,255,115,0.568627,1,0.45098
7507,Ozark-Ouachita Shortleaf Pine-Bluestem Woodland,Tree,Conifer,116,214,190,0.454902,0.839216,0.745098
7509,Mississippi River Alluvial Plain Dry-Mesic Loess Slope Forest,Tree,Hardwood,85,187,194,0.333333,0.733333,0.760784
7510,Crowley's Ridge Sand Forest,Tree,Conifer-Hardwood,116,214,190,0.454902,0.839216,0.745098
7511,Appalachian Northern Hardwood Forest,Tree,Hardwood,0,38,115,0,0.14902,0.45098
7512,Appalachian (Hemlock)-Northern Hardwood Forest,Tree,Conifer-Hardwood,0,38,115,0,0.14902,0.45098
7513,Lower Mississippi River Flatwoods,Tree,Riparian,145,255,115,0.568627,1,0.45098
7514,Central Florida Herbaceous Pondshore,Herb,Riparian,255,153,0,1,0.6,0
7515,Southern Coastal Plain Herbaceous Seep and Bog,Herb,Riparian,255,153,0,1,0.6,0
7516,Atlantic Coastal Plain Sandhill Seep,Herb,Riparian,255,153,0,1,0.6,0
7517,Paleozoic Plateau Bluff and Talus Woodland,Tree,Hardwood,85,187,194,0.333333,0.733333,0.760784
7518,North-Central Interior Wet Flatwoods,Tree,Riparian,145,255,115,0.568627,1,0.45098
7519,East-Central Texas Plains Post Oak Savanna and Woodland,Tree,Hardwood,85,187,194,0.333333,0.733333,0.760784
7522,Northern Atlantic Coastal Plain Heathland,Shrub,Shrubland,240,165,46,0.941176,0.647059,0.180392
7523,Edwards Plateau Dry-Mesic Slope Forest and Woodland,Tree,Conifer-Hardwood,34,109,153,0.133333,0.427451,0.6
7524,Edwards Plateau Mesic Canyon,Tree,Hardwood,34,109,153,0.133333,0.427451,0.6
7525,Edwards Plateau Riparian Forest and Woodland,Tree,Riparian,6,53,122,0.023529,0.207843,0.478431
7527,East Gulf Coastal Plain Interior Oak Forest,Tree,Hardwood,116,214,190,0.454902,0.839216,0.745098
7545,East Gulf Coastal Plain Near-Coast Pine Wet Flatwoods,Tree,Riparian,116,214,204,0.454902,0.839216,0.8
7546,East Gulf Coastal Plain Interior Shortleaf Pine-Oak Forest,Tree,Conifer-Hardwood,116,214,190,0.454902,0.839216,0.745098
7547,Central Florida Pine Wet Flatwoods,Tree,Riparian,116,214,204,0.454902,0.839216,0.8
7548,South Florida Pine Wet Flatwoods,Tree,Riparian,116,214,204,0.454902,0.839216,0.8
7554,Acadian Low-Elevation Hardwood Forest,Tree,Hardwood,186,54,14,0.729412,0.211765,0.054902
7555,Acadian Low-Elevation Spruce-Fir-Hardwood Forest,Tree,Conifer-Hardwood,186,54,14,0.729412,0.211765,0.054902
7556,Central Appalachian Oak Rocky Woodland,Tree,Hardwood,13,69,133,0.05098,0.270588,0.521569
7557,Central Appalachian Pine-Oak Rocky Woodland,Tree,Conifer-Hardwood,13,69,133,0.05098,0.270588,0.521569
7560,Tamaulipan Mesquite Upland Scrub,Shrub,Shrubland,82,52,34,0.321569,0.203922,0.133333
7561,Llano Uplift Acidic Herbaceous Glade,Herb,Grassland,34,109,153,0.133333,0.427451,0.6
7562,Tamaulipan Riparian Shrubland,Shrub,Riparian,6,53,122,0.023529,0.207843,0.478431
7563,Edwards Plateau Riparian Shrubland,Shrub,Riparian,6,53,122,0.023529,0.207843,0.478431
7564,Edwards Plateau Riparian Herbaceous,Herb,Riparian,6,53,122,0.023529,0.207843,0.478431
7565,Florida Peninsula Inland Scrub Woodland,Tree,Conifer,145,255,115,0.568627,1,0.45098
7566,Florida Dry Prairie Shruband,Shrub,Shrubland,116,214,204,0.454902,0.839216,0.8
7567,Southern Coastal Plain Blackland Prairie Woodland,Tree,Conifer-Hardwood,0,38,115,0,0.14902,0.45098
7571,Southern Coastal Plain Seepage Swamp and Baygall Shrubland,Shrub,Riparian,216,216,191,0.847059,0.847059,0.74902
7573,Tamaulipan Riparian Herbaceous,Herb,Riparian,6,53,122,0.023529,0.207843,0.478431
7578,East Gulf Coastal Plain Wet Savanna,Tree,Riparian,255,153,0,1,0.6,0
7582,Ozark-Ouachita Oak Forest and Woodland,Tree,Hardwood,116,214,190,0.454902,0.839216,0.745098
7583,Ozark-Ouachita Shortleaf Pine-Oak Forest and Woodland,Tree,Conifer-Hardwood,116,214,190,0.454902,0.839216,0.745098
7584,West Gulf Coastal Plain Hardwood Forest,Tree,Hardwood,145,255,115,0.568627,1,0.45098
7585,West Gulf Coastal Plain Pine-Hardwood Forest,Tree,Conifer-Hardwood,145,255,115,0.568627,1,0.45098
7586,West Gulf Coastal Plain Sandhill Oak Forest and Woodland,Tree,Hardwood,116,214,190,0.454902,0.839216,0.745098
7587,West Gulf Coastal Plain Sandhill Oak and Shortleaf Pine Forest and Woodland,Tree,Conifer-Hardwood,116,214,190,0.454902,0.839216,0.745098
7588,East Gulf Coastal Plain Southern Hardwood Flatwoods,Tree,Hardwood,100,204,206,0.392157,0.8,0.807843
7589,East Gulf Coastal Plain Southern Loblolly-Hardwood Flatwoods,Tree,Conifer-Hardwood,100,204,206,0.392157,0.8,0.807843
7590,West Gulf Coastal Plain Hardwood Flatwoods,Tree,Hardwood,145,255,115,0.568627,1,0.45098
7591,West Gulf Coastal Plain Pine-Hardwood Flatwoods,Tree,Conifer-Hardwood,145,255,115,0.568627,1,0.45098
7662,Temperate Pacific Freshwater Emergent Marsh,Herb,Riparian,255,153,0,1,0.6,0
7663,North Pacific Shrub Swamp,Shrub,Shrubland,166,76,17,0.65098,0.298039,0.066667
7668,Temperate Pacific Tidal Salt and Brackish Marsh,Herb,Riparian,255,153,10,1,0.6,0.039216
7669,Temperate Pacific Intertidal Flat,Sparse,Sparsely Vegetated,100,100,100,0.392157,0.392157,0.392157
7733,North Pacific Montane Massive Bedrock-Cliff and Talus,Sparse,Sparsely Vegetated,100,100,100,0.392157,0.392157,0.392157
7734,North Pacific Alpine and Subalpine Bedrock and Scree,Sparse,Sparsely Vegetated,100,100,100,0.392157,0.392157,0.392157
7735,North American Glacier and Ice Field,Snow-Ice,Snow-Ice,159,161,240,0.623529,0.631373,0.941176
7736,Unconsolidated Shore,Sparse,Sparsely Vegetated,100,100,100,0.392157,0.392157,0.392157
7737,North American Glacial Outwash,Sparse,Sparsely Vegetated,100,100,100,0.392157,0.392157,0.392157
7754,Agriculture-Pasture and Hay,Herb,Agricultural,227,212,28,0.890196,0.831373,0.109804
7755,Agriculture-Cultivated Crops and Irrigated Agriculture,Agriculture,Agricultural,250,255,119,0.980392,1,0.466667
7800,Hawai'i Floodplain Forest,Tree,Riparian,255,105,46,1,0.411765,0.180392
7802,Hawai'i Riparian Forest,Tree,Riparian,255,105,46,1,0.411765,0.180392
7804,Hawai'i Freshwater Marsh,Herb,Riparian,255,153,0,1,0.6,0
7806,Hawai'i Bog,Herb,Grassland,255,114,48,1,0.447059,0.188235
7807,Northern Polynesia Tidal Salt Marsh,Herb,Grassland,255,153,10,1,0.6,0.039216
7808,Hawai'i Lowland Rainforest,Tree,Hardwood,192,255,138,0.752941,1,0.541176
7809,Hawai'i Montane Cloud Forest,Tree,Hardwood,192,255,138,0.752941,1,0.541176
7810,Hawai'i Montane Rainforest,Tree,Hardwood,192,255,138,0.752941,1,0.541176
7811,Hawai'i Wet Cliff and Ridge Crest Shrubland,Shrub,Shrubland,150,58,12,0.588235,0.227451,0.047059
7812,Hawai'i Mesic Coastal Forest,Tree,Hardwood,0,92,0,0,0.360784,0
7813,Hawai'i Lowland Dry Forest,Tree,Hardwood,186,163,119,0.729412,0.639216,0.466667
7814,Hawai'i Lowland Mesic Forest,Tree,Hardwood,0,92,0,0,0.360784,0
7815,Hawai'i Montane-Subalpine Dry Forest and Woodland,Tree,Hardwood,186,163,119,0.729412,0.639216,0.466667
7816,Hawai'i Montane-Subalpine Mesic Forest,Tree,Hardwood,0,92,0,0,0.360784,0
7817,Hawai'i Lowland Dry Shrubland,Shrub,Shrubland,156,128,92,0.611765,0.501961,0.360784
7818,Hawai'i Lowland Mesic Shrubland,Shrub,Shrubland,150,58,12,0.588235,0.227451,0.047059
7819,Hawai'i Lowland Dry Grassland,Herb,Grassland,251,121,54,0.984314,0.47451,0.211765
7820,Hawai'i Lowland Mesic Grassland,Herb,Grassland,255,114,48,1,0.447059,0.188235
7821,Hawai'i Montane-Subalpine Dry Shrubland,Shrub,Shrubland,156,128,92,0.611765,0.501961,0.360784
7822,Hawai'i Montane-Subalpine Dry Grassland,Herb,Grassland,251,121,54,0.984314,0.47451,0.211765
7823,Hawai'i Montane-Subalpine Mesic Grassland,Herb,Grassland,255,114,48,1,0.447059,0.188235
7824,Hawai'i Alpine Dwarf-Shrubland,Shrub,Shrubland,150,58,12,0.588235,0.227451,0.047059
7826,Hawai'i Dry Coastal Strand Shrubland,Shrub,Shrubland,150,58,12,0.588235,0.227451,0.047059
7827,Hawai'i Wet-Mesic Coastal Strand,Shrub,Shrubland,150,58,12,0.588235,0.227451,0.047059
7828,Hawai'i Subalpine Mesic Shrubland,Shrub,Shrubland,255,114,48,1,0.447059,0.188235
7829,Hawai'i Alpine Bedrock and Scree,Sparse,Sparsely Vegetated,100,100,100,0.392157,0.392157,0.392157
7830,Hawai'i Dry Coastal Strand Sparse Vegetation,Sparse,Sparsely Vegetated,100,100,100,0.392157,0.392157,0.392157
7831,Hawai'i Dry-Site Lava Flow,Sparse,Sparsely Vegetated,100,100,100,0.392157,0.392157,0.392157
7832,Hawai'I Floodplain Shrubland,Shrub,Riparian,255,105,46,1,0.411765,0.180392
7833,Hawai'i Riparian Shrubland,Shrub,Riparian,255,105,46,1,0.411765,0.180392
7834,Tropical Pacific Orchard,Tree,Agricultural,210,28,94,0.823529,0.109804,0.368627
7835,Tropical Pacific Bush fruit and Berries,Shrub,Agricultural,210,28,119,0.823529,0.109804,0.466667
7836,Tropical Pacific Aquaculture,Agriculture,Agricultural,210,255,237,0.823529,1,0.929412
7837,Sugar Cane,Herb,Agricultural,250,255,119,0.980392,1,0.466667
7838,Caribbean Bush fruit and berries,Shrub,Agricultural,210,28,119,0.823529,0.109804,0.466667
7860,Caribbean Coastal Dry Evergreen Forest,Tree,Hardwood,0,92,0,0,0.360784,0
7861,Caribbean Coastal Mangrove,Tree,Riparian,91,195,199,0.356863,0.764706,0.780392
7862,Caribbean Coastal Rocky Shore,Sparse,Sparsely Vegetated,100,100,100,0.392157,0.392157,0.392157
7863,Caribbean Coastal Thornscrub,Shrub,Shrubland,145,255,115,0.568627,1,0.45098
7864,Caribbean Dry Karst Shrubland,Shrub,Shrubland,145,255,115,0.568627,1,0.45098
7865,"Caribbean Edapho-Xerophilous ""Mogote"" Complex",Tree,Hardwood,96,255,71,0.376471,1,0.278431
7866,Caribbean Emergent Herbaceous Estuary,Herb,Riparian,112,82,57,0.439216,0.321569,0.223529
7867,Caribbean Estuary Mangrove,Tree,Riparian,91,195,199,0.356863,0.764706,0.780392
7868,Caribbean Floodplain Forest,Tree,Riparian,156,128,92,0.611765,0.501961,0.360784
7869,Caribbean Freshwater Marsh,Herb,Riparian,112,82,57,0.439216,0.321569,0.223529
7870,Caribbean Lowland Moist Serpentine Woodland,Tree,Hardwood,0,222,0,0,0.870588,0
7871,Caribbean Montane Meadow,Herb,Grassland,116,214,204,0.454902,0.839216,0.8
7872,Caribbean Montane Wet Elfin Forest,Tree,Hardwood,174,245,224,0.682353,0.960784,0.878431
7873,Caribbean Montane Wet Serpentine Woodland,Tree,Hardwood,0,222,0,0,0.870588,0
7874,Caribbean Montane Wet Short Shrubland,Shrub,Riparian,112,82,57,0.439216,0.321569,0.223529
7875,Caribbean Riparian Forest,Tree,Riparian,156,128,92,0.611765,0.501961,0.360784
7876,Caribbean Salt Flat and Pond,Sparse,Sparsely Vegetated,100,100,100,0.392157,0.392157,0.392157
7877,Caribbean Sand Beach Vegetation,Sparse,Sparsely Vegetated,100,100,100,0.392157,0.392157,0.392157
7878,Caribbean Sand Savanna,Tree,Hardwood,131,222,110,0.513725,0.870588,0.431373
7879,Caribbean Seasonal Evergreen Lowland Forest,Tree,Hardwood,0,222,0,0,0.870588,0
7880,Caribbean Seasonal Evergreen Submontane/Lowland Forest,Tree,Hardwood,0,222,0,0,0.870588,0
7881,Caribbean Semi-deciduous Lowland Forest,Tree,Hardwood,180,255,148,0.705882,1,0.580392
7882,Caribbean Serpentine Dry Scrub,Shrub,Shrubland,145,255,115,0.568627,1,0.45098
7883,Caribbean Submontane/Montane Karstic Forest,Tree,Hardwood,174,245,224,0.682353,0.960784,0.878431
7884,Caribbean Wet Montane Forest,Tree,Riparian,156,128,92,0.611765,0.501961,0.360784
7885,Caribbean Wet Submontane/Lowland Forest,Tree,Riparian,156,128,92,0.611765,0.501961,0.360784
7886,Stabilized Caribbean Dunes,Sparse,Sparsely Vegetated,100,100,100,0.392157,0.392157,0.392157
7887,Caribbean Floodplain Shrubland,Shrub,Riparian,156,128,92,0.611765,0.501961,0.360784
7888,Caribbean Riparian Shrubland,Shrub,Riparian,156,128,92,0.611765,0.501961,0.360784
7900,Western Cool Temperate Urban Deciduous Forest,Tree,Developed,112,68,137,0.439216,0.266667,0.537255
7901,Western Cool Temperate Urban Evergreen Forest,Tree,Developed,170,102,205,0.666667,0.4,0.803922
7902,Western Cool Temperate Urban Mixed Forest,Tree,Developed,194,158,215,0.760784,0.619608,0.843137
7903,Western Cool Temperate Urban Herbaceous,Herb,Developed,202,122,245,0.792157,0.478431,0.960784
7904,Western Cool Temperate Urban Shrubland,Shrub,Developed,207,171,215,0.811765,0.670588,0.843137
7905,Eastern Cool Temperate Urban Deciduous Forest,Tree,Developed,112,68,137,0.439216,0.266667,0.537255
7906,Eastern Cool Temperate Urban Evergreen Forest,Tree,Developed,170,102,205,0.666667,0.4,0.803922
7907,Eastern Cool Temperate Urban Mixed Forest,Tree,Developed,194,158,215,0.760784,0.619608,0.843137
7908,Eastern Cool Temperate Urban Herbaceous,Herb,Developed,202,122,245,0.792157,0.478431,0.960784
7909,Eastern Cool Temperate Urban Shrubland,Shrub,Developed,207,171,215,0.811765,0.670588,0.843137
7910,Western Warm Temperate Urban Deciduous Forest,Tree,Developed,112,68,137,0.439216,0.266667,0.537255
7911,Western Warm Temperate Urban Evergreen Forest,Tree,Developed,170,102,205,0.666667,0.4,0.803922
7912,Western Warm Temperate Urban Mixed Forest,Tree,Developed,194,158,215,0.760784,0.619608,0.843137
7913,Western Warm Temperate Urban Herbaceous,Herb,Developed,202,122,245,0.792157,0.478431,0.960784
7914,Western Warm Temperate Urban Shrubland,Shrub,Developed,207,171,215,0.811765,0.670588,0.843137
7915,Eastern Warm Temperate Urban Deciduous Forest,Tree,Developed,112,68,137,0.439216,0.266667,0.537255
7916,Eastern Warm Temperate Urban Evergreen Forest,Tree,Developed,170,102,205,0.666667,0.4,0.803922
7917,Eastern Warm Temperate Urban Mixed Forest,Tree,Developed,194,158,215,0.760784,0.619608,0.843137
7918,Eastern Warm Temperate Urban Herbaceous,Herb,Developed,202,122,245,0.792157,0.478431,0.960784
7919,Eastern Warm Temperate Urban Shrubland,Shrub,Developed,207,171,215,0.811765,0.670588,0.843137
7920,Western Cool Temperate Developed Deciduous Forest,Tree,Developed,64,61,168,0.25098,0.239216,0.658824
7921,Western Cool Temperate Developed Evergreen Forest,Tree,Developed,102,119,205,0.4,0.466667,0.803922
7922,Western Cool Temperate Developed Mixed Forest,Tree,Developed,68,79,137,0.266667,0.309804,0.537255
7923,Western Cool Temperate Developed Shrubland,Shrub,Developed,122,142,245,0.478431,0.556863,0.960784
7924,Western Cool Temperate Developed Herbaceous,Herb,Developed,158,170,215,0.619608,0.666667,0.843137
7925,Eastern Cool Temperate Developed Deciduous Forest,Tree,Developed,64,61,168,0.25098,0.239216,0.658824
7926,Eastern Cool Temperate Developed Evergreen Forest,Tree,Developed,102,119,205,0.4,0.466667,0.803922
7927,Eastern Cool Temperate Developed Mixed Forest,Tree,Developed,68,79,137,0.266667,0.309804,0.537255
7928,Eastern Cool Temperate Developed Shrubland,Shrub,Developed,122,142,245,0.478431,0.556863,0.960784
7929,Eastern Cool Temperate Developed Herbaceous,Herb,Developed,158,170,215,0.619608,0.666667,0.843137
7930,Western Warm Temperate Developed Deciduous Forest,Tree,Developed,64,61,168,0.25098,0.239216,0.658824
7931,Western Warm Temperate Developed Evergreen Forest,Tree,Developed,102,119,205,0.4,0.466667,0.803922
7932,Western Warm Temperate Developed Mixed Forest,Tree,Developed,68,79,137,0.266667,0.309804,0.537255
7933,Western Warm Temperate Developed Shrubland,Shrub,Developed,122,142,245,0.478431,0.556863,0.960784
7934,Western Warm Temperate Developed Herbaceous,Herb,Developed,158,170,215,0.619608,0.666667,0.843137
7935,Eastern Warm Temperate Developed Deciduous Forest,Tree,Developed,64,61,168,0.25098,0.239216,0.658824
7936,Eastern Warm Temperate Developed Evergreen Forest,Tree,Developed,102,119,205,0.4,0.466667,0.803922
7937,Eastern Warm Temperate Developed Mixed Forest,Tree,Developed,68,79,137,0.266667,0.309804,0.537255
7938,Eastern Warm Temperate Developed Shrubland,Shrub,Developed,122,142,245,0.478431,0.556863,0.960784
7939,Eastern Warm Temperate Developed Herbaceous,Herb,Developed,158,170,215,0.619608,0.666667,0.843137
7960,Western Cool Temperate Orchard,Tree,Agricultural,210,28,94,0.823529,0.109804,0.368627
7961,Western Cool Temperate Vineyard,Agriculture,Agricultural,168,0,132,0.658824,0,0.517647
7962,Western Cool Temperate Bush fruit and berries,Shrub,Agricultural,210,28,119,0.823529,0.109804,0.466667
7963,Western Cool Temperate Row Crop - Close Grown Crop,Agriculture,Agricultural,255,245,140,1,0.960784,0.54902
7964,Western Cool Temperate Row Crop,Agriculture,Agricultural,250,255,119,0.980392,1,0.466667
7965,Western Cool Temperate Close Grown Crop,Agriculture,Agricultural,255,237,119,1,0.929412,0.466667
7966,Western Cool Temperate Fallow/Idle Cropland,Herb,Agricultural,255,255,119,1,1,0.466667
7967,Western Cool Temperate Pasture and Hayland,Herb,Agricultural,227,212,28,0.890196,0.831373,0.109804
7968,Western Cool Temperate Wheat,Agriculture,Agricultural,250,227,163,0.980392,0.890196,0.639216
7970,Eastern Cool Temperate Orchard,Tree,Agricultural,210,28,94,0.823529,0.109804,0.368627
7971,Eastern Cool Temperate Vineyard,Agriculture,Agricultural,168,0,132,0.658824,0,0.517647
7972,Eastern Cool Temperate Bush fruit and berries,Shrub,Agricultural,210,28,119,0.823529,0.109804,0.466667
7973,Eastern Cool Temperate Row Crop - Close Grown Crop,Agriculture,Agricultural,255,245,140,1,0.960784,0.54902
7974,Eastern Cool Temperate Row Crop,Agriculture,Agricultural,250,255,119,0.980392,1,0.466667
7975,Eastern Cool Temperate Close Grown Crop,Agriculture,Agricultural,255,237,119,1,0.929412,0.466667
7976,Eastern Cool Temperate Fallow/Idle Cropland,Herb,Agricultural,255,255,119,1,1,0.466667
7977,Eastern Cool Temperate Pasture and Hayland,Herb,Agricultural,227,212,28,0.890196,0.831373,0.109804
7978,Eastern Cool Temperate Wheat,Agriculture,Agricultural,250,227,163,0.980392,0.890196,0.639216
7979,Eastern Cool Temperate Aquaculture,Agriculture,Agricultural,210,255,237,0.823529,1,0.929412
7980,Western Warm Temperate Orchard,Tree,Agricultural,210,28,94,0.823529,0.109804,0.368627
7981,Western Warm Temperate Vineyard,Agriculture,Agricultural,168,0,132,0.658824,0,0.517647
7982,Western Warm Temperate Bush fruit and berries,Shrub,Agricultural,210,28,119,0.823529,0.109804,0.466667
7983,Western Warm Temperate Row Crop - Close Grown Crop,Agriculture,Agricultural,255,245,140,1,0.960784,0.54902
7984,Western Warm Temperate Row Crop,Agriculture,Agricultural,250,255,119,0.980392,1,0.466667
7985,Western Warm Temperate Close Grown Crop,Agriculture,Agricultural,255,237,119,1,0.929412,0.466667
7986,Western Warm Temperate Fallow/Idle Cropland,Herb,Agricultural,255,255,119,1,1,0.466667
7987,Western Warm Temperate Pasture and Hayland,Herb,Agricultural,227,212,28,0.890196,0.831373,0.109804
7988,Western Warm Temperate Wheat,Agriculture,Agricultural,250,227,163,0.980392,0.890196,0.639216
7989,Western Warm Temperate Aquaculture,Agriculture,Agricultural,210,255,237,0.823529,1,0.929412
7990,Eastern Warm Temperate Orchard,Tree,Agricultural,210,28,94,0.823529,0.109804,0.368627
7991,Eastern Warm Temperate Vineyard,Agriculture,Agricultural,168,0,132,0.658824,0,0.517647
7992,Eastern Warm Temperate Bush fruit and berries,Shrub,Agricultural,210,28,119,0.823529,0.109804,0.466667
7993,Eastern Warm Temperate Row Crop - Close Grown Crop,Agriculture,Agricultural,255,245,140,1,0.960784,0.54902
7994,Eastern Warm Temperate Row Crop,Agriculture,Agricultural,250,255,119,0.980392,1,0.466667
7995,Eastern Warm Temperate Close Grown Crop,Agriculture,Agricultural,255,237,119,1,0.929412,0.466667
7996,Eastern Warm Temperate Fallow/Idle Cropland,Herb,Agricultural,255,255,119,1,1,0.466667
7997,Eastern Warm Temperate Pasture and Hayland,Herb,Agricultural,227,212,28,0.890196,0.831373,0.109804
7998,Eastern Warm Temperate Wheat,Agriculture,Agricultural,250,227,163,0.980392,0.890196,0.639216
7999,Eastern Warm Temperate Aquaculture,Agriculture,Agricultural,210,255,237,0.823529,1,0.929412
9001,Colorado Plateau Mixed Bedrock Canyon and Tableland,Sparse,Sparsely Vegetated,100,100,100,0.392157,0.392157,0.392157
9002,Columbia Basin Foothill Riparian Woodland,Tree,Riparian,73,171,186,0.286275,0.670588,0.729412
9003,Great Basin Foothill and Lower Montane Riparian Woodland,Tree,Riparian,73,171,186,0.286275,0.670588,0.729412
9004,Inter-Mountain Basins Active and Stabilized Dune,Sparse,Sparsely Vegetated,100,100,100,0.392157,0.392157,0.392157
9005,Inter-Mountain Basins Alkaline Closed Depression,Herb,Riparian,250,100,56,0.980392,0.392157,0.219608
9006,Inter-Mountain Basins Cliff and Canyon,Sparse,Sparsely Vegetated,100,100,100,0.392157,0.392157,0.392157
9008,Inter-Mountain Basins Playa,Sparse,Sparsely Vegetated,100,100,100,0.392157,0.392157,0.392157
9009,Inter-Mountain Basins Shale Badland,Sparse,Sparsely Vegetated,100,100,100,0.392157,0.392157,0.392157
9010,Inter-Mountain Basins Wash,Sparse,Sparsely Vegetated,100,100,100,0.392157,0.392157,0.392157
9011,North American Arid West Emergent Marsh,Herb,Riparian,250,100,56,0.980392,0.392157,0.219608
9012,Northern Rocky Mountain Lower Montane Riparian Woodland,Tree,Riparian,73,171,186,0.286275,0.670588,0.729412
9014,Northwestern Great Plains Floodplain Forest and Woodland,Tree,Riparian,6,53,122,0.023529,0.207843,0.478431
9015,Northwestern Great Plains Riparian Forest ,Tree,Riparian,6,53,122,0.023529,0.207843,0.478431
9016,Rocky Mountain Alpine Bedrock and Scree,Sparse,Sparsely Vegetated,100,100,100,0.392157,0.392157,0.392157
9017,Rocky Mountain Alpine-Montane Wet Meadow,Herb,Riparian,184,96,24,0.721569,0.376471,0.094118
9018,Rocky Mountain Cliff Canyon and Massive Bedrock,Sparse,Sparsely Vegetated,100,100,100,0.392157,0.392157,0.392157
9019,Rocky Mountain Lower Montane-Foothill Riparian Woodland,Tree,Riparian,73,171,186,0.286275,0.670588,0.729412
9021,Rocky Mountain Subalpine-Montane Riparian Shrubland,Shrub,Riparian,184,96,24,0.721569,0.376471,0.094118
9022,Rocky Mountain Subalpine-Montane Riparian Woodland,Tree,Riparian,184,96,24,0.721569,0.376471,0.094118
9023,Western Great Plains Badlands,Sparse,Sparsely Vegetated,100,100,100,0.392157,0.392157,0.392157
9024,Western Great Plains Cliff and Outcrop,Sparse,Sparsely Vegetated,100,100,100,0.392157,0.392157,0.392157
9025,Western Great Plains Closed Depression Wetland,Herb,Riparian,255,137,64,1,0.537255,0.25098
9026,Western Great Plains Floodplain Forest and Woodland,Tree,Riparian,6,53,122,0.023529,0.207843,0.478431
9027,Western Great Plains Open Freshwater Depression Wetland,Herb,Riparian,255,137,64,1,0.537255,0.25098
9028,Western Great Plains Riparian Woodland,Tree,Riparian,6,53,122,0.023529,0.207843,0.478431
9029,Western Great Plains Saline Depression Wetland,Herb,Riparian,255,137,64,1,0.537255,0.25098
9030,Columbia Plateau Silver Sagebrush Seasonally Flooded Shrub-Steppe,Shrub,Riparian,184,96,24,0.721569,0.376471,0.094118
9032,Columbia Plateau Ash and Tuff Badland,Sparse,Sparsely Vegetated,100,100,100,0.392157,0.392157,0.392157
9033,Inter-Mountain Basins Volcanic Rock and Cinder Land,Sparse,Sparsely Vegetated,100,100,100,0.392157,0.392157,0.392157
9034,North American Warm Desert Riparian Woodland,Tree,Riparian,81,180,141,0.317647,0.705882,0.552941
9035,North American Warm Desert Lower Montane Riparian Woodland,Tree,Riparian,81,180,141,0.317647,0.705882,0.552941
9036,Acadian Coastal Salt Marsh,Herb,Riparian,255,92,38,1,0.360784,0.14902
9037,Acadian Estuary Marsh,Herb,Riparian,255,92,38,1,0.360784,0.14902
9038,Acadian Maritime Bog,Shrub,Riparian,186,163,119,0.729412,0.639216,0.466667
9039,Acadian-Appalachian Conifer Seepage Forest,Tree,Riparian,186,54,14,0.729412,0.211765,0.054902
9040,Acadian-North Atlantic Rocky Coast,Sparse,Sparsely Vegetated,100,100,100,0.392157,0.392157,0.392157
9041,Atlantic Coastal Plain Blackwater Stream Floodplain Forest,Tree,Riparian,145,255,115,0.568627,1,0.45098
9042,Atlantic Coastal Plain Brownwater Stream Floodplain Forest,Tree,Riparian,145,255,115,0.568627,1,0.45098
9044,Atlantic Coastal Plain Embayed Region Tidal Freshwater Marsh,Herb,Riparian,255,153,0,1,0.6,0
9045,Atlantic Coastal Plain Embayed Region Tidal Salt and Brackish Marsh,Herb,Riparian,255,153,0,1,0.6,0
9047,Atlantic Coastal Plain Indian River Lagoon Tidal Marsh,Herb,Riparian,255,153,0,1,0.6,0
9048,Atlantic Coastal Plain Northern Bog,Shrub,Riparian,133,39,8,0.521569,0.152941,0.031373
9050,Atlantic Coastal Plain Small Blackwater River Floodplain Forest,Tree,Riparian,145,255,115,0.568627,1,0.45098
9051,Atlantic Coastal Plain Small Brownwater River Floodplain Forest,Tree,Riparian,145,255,115,0.568627,1,0.45098
9055,Boreal-Laurentian Bog,Shrub,Riparian,186,163,119,0.729412,0.639216,0.466667
9056,Boreal-Laurentian Conifer Acidic Swamp and Treed Poor Fen,Tree,Riparian,186,163,119,0.729412,0.639216,0.466667
9057,Boreal-Laurentian-Acadian Acidic Basin Fen,Shrub,Riparian,255,92,38,1,0.360784,0.14902
9059,Central Appalachian River Floodplain Forest,Tree,Riparian,0,92,0,0,0.360784,0
9060,Central Appalachian Stream and Riparian Woodland,Tree,Riparian,0,92,0,0,0.360784,0
9061,Central Atlantic Coastal Plain Sandy Beach,Sparse,Sparsely Vegetated,100,100,100,0.392157,0.392157,0.392157
9062,Central California Coast Ranges Cliff and Canyon,Sparse,Sparsely Vegetated,100,100,100,0.392157,0.392157,0.392157
9063,Central Florida Wet Prairie and Herbaceous Seep,Herb,Riparian,255,153,0,1,0.6,0
9064,Central Interior Acidic Cliff and Talus,Sparse,Sparsely Vegetated,100,100,100,0.392157,0.392157,0.392157
9065,Central Interior Calcareous Cliff and Talus,Sparse,Sparsely Vegetated,100,100,100,0.392157,0.392157,0.392157
9066,Central Interior Highlands and Appalachian Sinkhole and Depression Pond,Tree,Riparian,0,92,0,0,0.360784,0
9068,Central Texas Coastal Prairie Riparian Forest,Tree,Riparian,145,255,115,0.568627,1,0.45098
9069,Central Texas Coastal Prairie River Floodplain Forest,Tree,Riparian,145,255,115,0.568627,1,0.45098
9071,Columbia Bottomlands Forest and Woodland,Tree,Riparian,145,255,115,0.568627,1,0.45098
9073,Cumberland Acidic Cliff and Rockhouse,Sparse,Sparsely Vegetated,100,100,100,0.392157,0.392157,0.392157
9075,Cumberland Seepage Forest,Tree,Riparian,0,92,0,0,0.360784,0
9077,East Gulf Coastal Plain Depression Pondshore,Herb,Riparian,255,153,0,1,0.6,0
9080,East Gulf Coastal Plain Freshwater Tidal Wooded Swamp,Tree,Riparian,216,216,191,0.847059,0.847059,0.74902
